description,y
"Bachelor’s degree in Computer Science, Electrical Engineering, or related fields4+ years of relevant professional software engineering experience3+ years professional experience with data structures, algorithm design, problem solving, and complexity analysis1+ years of professional Machine Learning experienceAdvanced coding and design skills in at least one modern programming language such as Java, Python, C# or C++Advanced functional skills with computer science fundamentals in object-oriented design, data structures, modeling, solution architecture and algorithmsSolid background in statistical learning techniquesAble to work both independently with negligible guidance, actively collaborate with team members and mentor junior ML engineersHigh sense of ownership, self-motivation, and desire to delight customers; obsessed with quality and customer experience

Operations Technology IT
We develop and deliver technology that supports Amazon Operations at worldwide scope and scale that is unparalleled. We are forming a new team focused on providing advanced image solutions that leverage both automated and semi-automated Computer Vision (CV) and Machine Learning (ML) processing techniques to provide enhanced safety, productivity, and quality controls throughout Amazon’s global operation sites. We will be automating image capture and analysis, large data set handling, using convolutional neural networks (CNNs) for classification and segmentation of images, spatial recognition of objects/distance/velocity relationships, real time and near-term operational feedback loops and large-scale process automation. See Amazon’s recently open sourced Distance Assistant as a good example of our work.

What You’ll Do
As a skilled Machine Learning Engineer II, you’ll have the opportunity to develop machine learning models based on static and dynamic unstructured data captured through Amazon’s network of computer vision devices, and to optimize and automate model training and testing for experimentation, development, and production, all in support of use cases related to promoting associate well being, detecting process flow anomalies and preventing customer defects. You’ll be using and honing your state-of-the-art machine learning skills daily and collaborating with cross-functional team members from multiple disciplines, including software development engineers, data scientists, system development engineers, business intelligence engineers, applied scientists and operations specialists to create new AI-driven solutions to meet challenging and meaningful problems at enormous scale.

Experience developing ML models that utilize large, unstructured data sets, such as images or video files, to automate image evaluation, classification and anomaly detectionExperience with AWS baseline and ML services ((i.e. S3, Lambda, DynamoDB, SageMaker, Reckognition, etc.); AWS Certified ML Specialty a plusExperience with unsupervised or semi-supervised learning, metric learning and basis learningExperience in the real-time processing of high-velocity time series dataExperience with edge inference, including model compression and cloud/device inference architectures
Amazon is committed to a diverse and inclusive workplace. Amazon is an equal opportunity employer and does not discriminate on the basis of race, national origin, gender, gender identity, sexual orientation, protected veteran status, disability, age, or other legally protected status. For individuals with disabilities who would like to request an accommodation, please visit https://www.amazon.jobs/en/disability/us.",2
"Ascend Learning; LLC (www.ascendlearning.com) is a leading provider of technology-based educational, curriculum and assessment solutions for high-growth careers in a range of industries, including healthcare, fitness and wellness, and insurance and financial services. We provide outcomes-based solutions aimed at helping people enter, sustain, and succeed in their chosen fields. Ascend employs more than 1,300 employees, with headquarters in Burlington, Mass., and offices in Kansas City metro, Phoenix metro, Minneapolis-St. Paul, New York, and the U.K.

JOB DUTIES: Translate business requirements into detailed user stories and technical issues that can be interpreted by the engineering team. Ensure that the team delivers the intended functionality in a way that is consistent with the broader platform architecture and capabilities. Identify and analyze multiple data sources to support strategic decision-making. Lead a team of data engineers. Lead design, development and release of data models, data marts and ETL processes. Lead the team to transform analyzed data into clear recommendations to improve existing and new product development. Participate in estimation, and capacity and resource planning for projects Collaborate with business stakeholders, agile team members and project managers to understand business requirements and ensure timely delivery of project deliverables. Work with team members to proactively identify, communicate and resolve issues and risks that impede the execution and success of the project. Conduct analysis that identifies the current state of business processes and system inadequacies. Deliver recommendations for process and system improvements that assist the business in achieving its goals and objectives, leveraging best practices and professional experience. Participate in all relevant agile ceremonies for each project iteration including story tasking, task estimating, and story ownership.


REQUIREMENTS:
Bachelor’s or foreign equivalent degree in Computer Science, Computer Information Systems, Management Information Systems, Engineering, or a related field and Five (5) years of experience in the job offered or a related occupation.

Experience must include Five (5) years of experience with:

Writing SQL queries;
Building requirements and design artifacts for data related systems;
ETL and reporting systems (data-models and data-marts);
Agile methodologies;
SCRUM and Kanban.
Project management;
Leading engineering teams.


Ascend Learning, LLC is proud to be an equal opportunity employer (M/F/Vets/Disabled). No agency or search firm submissions will be accepted. Applications for U.S. based positions with Ascend Learning, LLC must be legally authorized to work in the United States and verification of employment eligibility will be required at the time of hire.",0
"Job Description
Data Scientist 2
Off-Price, Cross Function (Assortment, Funnel Optimization)
The vision for Data Science & Analytics at Nordstrom is to be the best data-driven fashion retailer in the world, and we win by being relevant to the customer through an application of insight and prediction to outcomes.
We’re looking for a Data Scientist to build practical solutions tailored to specific business needs of the fast-growing off-price channels of Nordstrom. The role will be responsible for collecting, analyzing and presenting data to influence decision making using advanced statistical methods , build ing the pipelines , and help ing determine the next generation of tools . This individual should have a high degree of curiosity about the business and the skills to discover impactful insights from data and communicate those insights in a way that builds confidence and enables decisions that drive business value.
We are part of the Nordstrom’s centralized Data Science and Analytic s team with the focus on the Off-price ( i.e. Nordstrom Rack) division . Here we build data science products and provide analytics consulting in support of strategic business decisions, including marketing, merchandise, supply chai n, and digital experience. We work as the brain for the Off-price division with passion for supporting data -driven decision making , a devotion to advanced techniques , and creative team spirit !
The ideal candidate is a creative self-starter and strong technical contributor who is always looking for new opportunities to solve business problems with data-driven tools. We welcome your curiosity about the business, your passion to unlock rich, nuanced insights from complicated data and the desire to communicate those insights in a way that drives positive business outcomes.
We are committed to building teams that reflect the diversity of our customers and active inclusion is core to how Nordstrom wins . We’re an equal opportunity employer and encourage individuals from all backgrounds to apply. If the idea to make a difference in this vibrant intersection of fashion, data science, and technology excites you, join our world-class data science team!
A day in the life...
Partner with key stakeholders on data analysis problems and translate stakeholder requests into sound methods at the Epic-level .
Apply advanced statistical methods, data modeling, and predictive analysis to answer strategic questions for the off-price business.
Extract and prepare large sets of data for analysis.
Perform large-scale statistical analysis and develop and apply segmentation, predictive models, and forecasting models to key business problems.
Research, design, and implement production-level, scalable code and algorithms.
Work within and across teams to develop and deploy data products and data-driven software, which provide marketing insights.
Collaborate with the BI and analytical teams, and support ad-hoc analysis.
Improve existing data resources by building data pipelines using AWS Cloud Services and other services.
Lead code and documentation reviews.
Educate adoption of Data Science/Machine Learning best practices within the CoE
Minimum qualifications include…
5+ years hands-on professional experience in Data Science and Analytics.
3-5+ years of strong coding skills in at least one statistical or programming language (e.g. R, Python) to import, process, summarize, and analyze data.
Bachelor’s, MS or PhD in mathematics, statistics, computer science or in quantitative field (or equivalent experience).
A solid grasp of the Scientific Method and its application to Data Science.
Fluency with descriptive and inferential statistical techniques, including experimental design (DOE) concepts and their application.
Proficiency with statistical and machine learning algorithms (e.g. regression, decision trees, collaborative filtering, clustering, survival analysis, graph theory, etc.).
Proficient in extracting large data sets from various relational databases using SQL (Amazon Redshift, Oracle, Teradata preferred).
Our ideal candidate has…
Strong background and proficiency with advanced methods such as (neural networks, Bayesian networks, deep learning, recommenders, etc.)
Deep knowledge of statistical and machine learning algorithms and experience developing and deploying them to production-level systems.
Experience working in a highly-collaborative environment (e.g. code sharing, using revision control, contributing to team discussions/workshops, and document sharing).
Experience developing and deploying data pipelines using Cloud Services (e.g. AWS).
Experience using engines such as Apache Spark or Hadoop to analyze large datasets.
Experience with developing and supporting RESTful infrastructure/payload.
Experience with data ETL.
Experience with REST or restFull APIs.
Strong coding skills in Python, Go, Scala, Java, C, and/or C++.
Familiarity with marketing analytics topics (e.g., digital tactics, targeting and customer segmentation, lifetime value forecasting, and incremental response modeling, to name a few).
You’ll love this Job If You
…are a self-directed individual who operates with passion, urgency, focus, and discipline … put simply, you get-stuff-done.
…have problem solving skills that are unparalleled …you are scrappy and resourceful
…are an a daptable team player . You will enthusiastically take on other assignments as needed to support your team!
…are d etailed-oriented with a knack for precision and accuracy in numbers and analyses .
…are someone who appreciates diversity in all its forms
…are someone who appreciates a company that values and encourages work-life balance
About Nordstrom
Nordstrom is a specialty retailer offering the very best in fashion and customer service since 1901. We live by five simple values that guide how we work together day-to-day and how we deliver analytics & data science products. We are customer-obsessed, owners at heart, curious and ever-changing, we extend ourselves to our peers and our customers, and we’re here to win! We're proud to be named to Fortune™ magazine's list of '100 Best Companies to Work For.' We believe this recognition comes from our desire to empower our employees to set their sights high and deliver exceptional service to customers.
We’ve got you covered…
Our employees are our most important asset and that’s reflected in our benefits. Nordstrom is proud to offer a variety of benefits to support employees and their families, including:
Medical/Vision, Dental, Retirement and Paid Time Away
Life Insurance and Disability
Merchandise Discount and EAP Resources
A few more important points...
The job posting highlights the most critical responsibilities and requirements of the job. It’s not all-inclusive. There may be additional duties, responsibilities and qualifications for this job.
Nordstrom will consider qualified applicants with criminal histories in a manner consistent with all legal requirements.
Applicants with disabilities who require assistance or accommodation should contact the nearest Nordstrom location, which can be identified at www.nordstrom.com .
Nordstrom Careers Privacy Policy: https://careers.nordstrom.com/#/contact-us/privacy
© 2020 Nordstrom, Inc.
Current Nordstrom employees: To apply, log into Workday, click the Careers button and then click Find Jobs.",1
"Data Scientist - (00054951)
Description

Why choose between doing meaningful work and having a fulfilling life? At MITRE, you can have both. That's because MITRE people are committed to tackling our nation's toughest challenges—and we're committed to the long-term well-being of our employees. MITRE is different from most technology companies. We are a not-for-profit corporation chartered to work for the public interest, with no commercial conflicts to influence what we do. The Research & Development centers we operate for the government create lasting impact in fields as diverse as cybersecurity, healthcare, aviation, defense, and enterprise transformation. We're making a difference every day—working for a safer, healthier, and more secure nation and world.

The HLSC Software and IT Systems Department is seeking talented data scientists experienced in data analytics and data visualization. With more and more data everywhere, the Department of Homeland Security (DHS) needs dedicated technical expertise and subject-matter support in data storage, security, computation, analysis and visualization.

Key Functions:
Acquire fundamental understanding of analytical equipment and tools to include open source intelligence (OSINT) platforms
Operate analytical equipment and tools
Perform processing and analysis of collected information
Support the development and application of a technical process approach to a sponsor problem
Present results in an intuitive manner that can be understood by all sponsor audiences, regardless of technical expertise and conduct insightful, actionable analyses
Experience with databases technologies (e.g., PostgreSQL, Oracle, MySQL, SQL Server, MongoDB, Neo4j)
Experience manipulating datasets with at least one modern programming language or business intelligence platform like Python, SAS, MATLAB, C++, R, Java, SQL, PL/SQL
Creatively apply visualizations to large datasets using tools like Tableau, Power BI, or Qlik
Ability to understand and map data relationships
Work with sponsors, vendors, and partner contractors to gain understanding of sponsor business challenges and evaluate possible technical solutions
Be a contributing member on a project team, able to be flexible with scope and schedule changes

Qualifications

Minimum Qualifications:
BS and 2 years of experience
Required Qualifications:
BS in Computer Science or other related discipline
2 or more years of experience with data analytics and data visualization
The candidate should possess extensive experience analyzing large scale datasets from prominent and emerging domains as well as complex social networks using unique and innovative methodologies.
The candidate should have a strong knowledge of data science, various programming languages, and open source technologies.
Skills sought include:
Experienced with utilizing existing open source social media methodologies to apply specialized tools and capabilities in support of the Department of Homeland Security (DHS) national security mission
Experienced organizing analytic results for further analysis
Ability to find patterns in data and clearly articulate the entire analysis (e.g., methodology, results, assumptions, constraints) using various suites of tools
Experienced with databases technologies (e.g., PostgreSQL, Oracle, MySQL, SQL Server, MongoDB, Neo4j)
Experienced manipulating datasets with at least one modern programming language or business intelligence platform like Python, SAS, MATLAB, C++, R, Java, SQL, PL/SQL
Creatively apply visualizations to large datasets using tools like Tableau, Power BI, or Qlik
Ability to understand and map data relationships
Ability to assess the quality of data or tool against a set of requirements
Ability to prepare comprehensive written reports, presentations, and charts based on research, collection, and analysis of intelligence data
Excellent written and verbal communication skills, adapted to a variety of audiences and technical understanding
Advanced and proven ability to:
Assess the gaps between current capabilities and target business/IT needs
Analyze and align business and technology strategies
Identify, analyze, and recommend high-impact alternative solutions and prototypes
Required Business/Soft Skills:

Experience in a customer-facing environment
Ability to leverage both MITRE and team knowledge effectively
Ability to work in a “war room” environment (i.e., close quarters within an open team room with multiple conversations)
Ability to work with a variety of audiences to include sponsors, vendors, and partner contractors
Strong communications and interpersonal skills
Must have good analytical, written, presentation skills
Strong interpersonal communication skills to interact with senior Government staff, technical peers, and MITRE team members
Ability to work in a dynamic fast-paced environment
Preferred Qualifications:
Candidates who currently possess DHS Suitability clearance
MITRE’s workplace reflects our values. We offer competitive benefits, exceptional professional development opportunities, and a culture of innovation that embraces diversity, inclusion, flexibility, collaboration, and career growth. If this sounds like the choice you want to make, then choose MITRE—and make a difference with us. For more information please visit https://www.mitre.org/careers/working-at-mitre. U.S Citizenship is required for most positions.


Primary Location: United States-Virginia-McLean
Work Locations: Washington 22102
Job: SW Eng, Comp Sci & Mathematics
This requisition requires a clearance of: DHS SCI/Fitness
Travel: Yes, 10 % of the Time
Job Posting: Jan 15, 2020, 6:46:45 PM",0
"********************************
Senior Machine Learning Engineer
********************************

About Jumpstart
---------------

Jumpstart is the world's first shared talent network -- we are a recruiting platform that connects job seekers to the world's best companies using machine learning. Candidates on Jumpstart are able to represent themselves in ways that go beyond paper resumes by describing not only their qualifications, but also their interests and values. Using this self-reported information and other data-rich sources, we algorithmically recommend the best candidates to recruiters (and vice-versa) to help both sides find the strongest mutual fit.

In a little over a year, Jumpstart has helped 100+ customers, including Airbnb, Pinterest, MongoDB, and JP Morgan hire more diverse talent. With its recent Series A funding (led by Sequoia Capital ( https://techcrunch.com/2019/12/18/jumpstart-nabs-8-5m-led-by-sequoia-for-a-recruitment-platform-that-aims-to-increase-diversity/?guccounter=1 )) and an experienced leadership team, Jumpstart is poised to transform the hiring industry.

About the Position
------------------------

Jumpstart is looking for a Machine Learning Engineer to help us build the next generation of data products that delight and excite our growing customer base. As a Machine Learning Engineer on the team, you will have the opportunity to define, experiment, build, and scale your solutions to millions of Jumpstart users. Our data is one-of-a-kind -- we build data-rich profiles for all job-seekers, jobs, and organizations on our platform by aggregating across various first-party and third-party data sources. Leveraging this data in clever ways will be a challenging, but rewarding technical challenge for the right candidate and we hope you'll join us on this journey.

Responsibilities
----------------


Design, implement, deploy, and maintain innovative Machine Learning (ML) algorithms that deliver outsized value to our present and future customers
Develop and scale production data and ML pipelines on which those algorithms operate
Run experiments and statistical analyses to fine-tune production models using test results
Work independently to define and execute a roadmap of ML projects that consume novel sources of data and deliver new capabilities for our users

Basic Qualifications
--------------------


5+ years of relevant experience on a Data Science or ML Engineering team OR MS/Ph.D in a quantitative field with 2+ years experience
Practical experience developing ML algorithms and building data pipelines that scale
Ability to write production-quality code in Python using ML toolkits (Tensorflow, PyTorch, Numpy)
Deep expertise in machine learning algorithms, probability, and statistics
Desire to propose and lead cross-functional projects that require coordination across stakeholders
A love for testing and experimentation
Great collaboration and communication skills; ability to translate technical jargon for a non-technical audience

Bonus Points
------------


Domain knowledge or experience working with recommender systems or two-sided marketplaces, particularly in a tech company
Experience with big data frameworks like Spark, MapReduce and/or distributed systems
Excited by ownership, autonomy, and impact of defining and building new data capabilities
Passion for helping job seekers find the right companies to jumpstart their careers
You can teach us a thing or two!

Perks
-----


Competitive salary and early-stage stock options package
Flexible PTO
Employer-paid health, dental, and vision coverage
401(k) plan with employer matching
Daily catered lunches

Jumpstart is an equal opportunity employer and affirmative action employer. We are committed to equal employment opportunity on the basis of race, color, religion, creed, gender, national origin, age, disability, veteran status, marital status, pregnancy, sex, gender expression or identity, sexual orientation, citizenship, or any other basis protected by applicable local, state or federal law. Jumpstart will also consider for employment qualified applicants with arrest and conviction records in a manner consistent with San Francisco's Fair Chance Ordinance and similar local laws. If you have a disability or special need that requires accommodation, please contact us at: accommodation.request@jumpstart.me",2
