description,y
"Jacobs is looking for a Data Scientist in McLean with an active TS/SCI with CI Poly. This role is responsible for improving analyst's collaborative workflow by developing tools and capabilities that enhance the ability to use and produce identity intelligence data.


Responsibilities:

Working independently and collaboratively in a team, on strategic projects to develop complex data models and solutions.
Analyzing, interpreting, and extracting data to support decision-making, engaging with customers to understand changing requirements, and recommending solutions based on quantitative analysis.
Independently compiles and reviews often disparate and inconsistent data to address complex intelligence issues or problems for internal/external customers.
May require constructing and performing complex statistical, mathematical, and data analysis independently, or in partnership with other data scientists or analysts.
Provides recommendations for the development of tools and applications that improve process effectiveness and efficiency.
#CJPOST
Qualifications
 Qualifications:
Experience supporting complex data science and analytic projects
Proficiency with Python or R
Experience using SQL to query large relational databases
Experience/knowledge of computer science concepts including programming/algorithm development, statistics, data architecture, data analytics, data science including visualization techniques
Experience with quantitative and qualitative analytics
Experience constructing and performing complex database search queries across multiple databases
Ability to effectively communicate complex technical findings to non-technical audiences in both written and verbal formats
Experience identifying, recommending, and implementing continuous improvement approaches
Overall 3 to 10 years of experience
Degree in BA/BS or MA/MS degree in a technical field such as mathematics, engineering, economics, or computer science
TS/SCI with CI Polygraph security clearance

Desired Skills:

Experience in modern machine learning, biometrics, social network analysis, or geospatial analysis
Experience/knowledge of link analysis tools ( e.g. Palantir, i2 Analyst’s Notebook)
Experience with cloud architectures including AWS
Experience with distributed computing and storage technologies


Essential Functions

Physical Requirements:

Most work will be done at a desk or computer.


Work Environment:

General Office environment. The work environment is fast-paced and sometimes involves extreme deadline pressures. The nature of the work requires a high degree of teamwork and cooperation with other members of the staff as well as individuals across the Company and Customers.


Equipment & Machines:

General office equipment including PC/laptop, Fax, Copiers, Shredder, Printers, Telephone, and other miscellaneous office equipment.


Attendance:

Attendance is critical at all times. Must be able to work a 40-hour workweek, normally Monday through Friday. However, times and days may vary depending on business requirements. Needs to be available to work overtime during critical peaks and be available to meet last minute requests for overtime should the situation occur.


Other Essential Functions:

Must be able to communicate effectively both verbally and in writing

Grooming and dress must be appropriate for the position and must not impose a safety risk/hazard to the employee or others. Must put forward a professional behavior that enhances productivity and promotes teamwork and cooperation.

Must be able to interface with individuals at all levels of the organization both verbally and in writing. Must be well-organized with the ability to coordinate and prioritize multiple tasks simultaneously. Must work well under pressure to meet deadline requirements. Must be willing to travel as needed. Must take and pass a drug test and background check as well as a motor vehicle records check. Must be a US citizen.
 
Jacobs is an Equal Opportunity/Affirmative Action Employer. All qualified applicants will receive consideration for employment without regard to race, religion, creed, color, national origin, ancestry, sex (including pregnancy, childbirth, breastfeeding, or medical conditions related to pregnancy, childbirth, or breastfeeding), age, medical condition, marital or domestic partner status, sexual orientation, gender, gender identity, gender expression and transgender status, mental disability or physical disability, genetic information, military or veteran status, citizenship, low-income status or any other status or characteristic protected by applicable law. Learn more about your rights under Federal EEO laws and supplemental language.",1
"Company: Well has a mission to create massive impact and affect change to healthcare through a differentiated consumer experience and a world-class data & analytics engine to drive engagement and behavior change. The product will sell directly to both Fortune 500 CEOs and full risk populations, integrating layers of analytics, digital, concierge services, behavioral health, telemedicine, care management and wellness services to drive sustained engagement, lower costs and improve health. A key differentiator to drive the company’s success will be a highly diverse, engaged organization whose employees are passionate about the mission of the company and whose management is passionate about the employees.Reporting To: Head of Data Science and AIPosition Summary: You will leverage a wide range of disparate data sources across healthcare (member, payor, employer, provider, partner). You will leverage a detailed understanding of epidemiology and experience finding causal effects in large longitudinal observational real world data or real world evidence.You will lead in the creation of operational causal models using current and emerging techniques including Bayesian methods. You will need to apply a deep theoretical understanding of statistics, and causal inference. Most importantly, you will teach and mentor others in these areas.Minimum Qualifications: 5+ years’ industry experience in statistical modeling focused roles.3+ years SQL experience3+ years Python experience3+ years Unix/OSX experienceAdvanced degree (MS or PhD) in a quantitative field such as Statistics, Computer Science, Physics, Economics, Mathematics, or similar. Strong grasp and theoretical understanding of statistics, particularly around Bayesian methods and applications in causal inference.Demonstrated experience using Python for building statistical models with a focus on causal inference and Bayesian methods (stan, pymc3, numpy, pandas, scikit-learn, etc.).Proficiency with SQL and databases. Experience using Unix/OSX from the command line, version control (git), and general software development best practices for contributing to a collaborative code base. Experience executing analyses in the cloud (GCP, AWS).Strong communication and collaboration skills required. Ability to communicate technical modeling concepts and relevant aspects of modeling platforms to non-technical audiences.Willingness to teach and mentor others across all technical skill areas and in knowledge of the healthcare domain. Ability to work in a start-up environment that is fast paced and maintain a focus on rapid prototyping of capabilitiesBackground and experience in healthcare and/or consumer-facing domains involving behavior changeAdditional Job InformationWell is on a mission to redefine the healthcare experience. This is an opportunity to re-shape healthcare for America. We are developing solutions to improve the quality and affordability of healthcare. We welcome team members who are passionate about that mission. We embrace diversity and are committed to building an inclusive team.Indeed Hire and Well are working together to find the best candidate for this job.By applying, you agree to be contacted by our agent, Indeed Hire, and receive updates via text and phone about your application.Job Type: Full-timeSalary: $150,000.00 /yearExperience:statistical modeling: 5 years (Required)SQL: 1 year (Required)healthcare industry: 2 years (Preferred)Python: 1 year (Required)Education:High school or equivalent (Preferred)Job distance:New York, NY: Between 31 and 40 miles (Preferred)",1
