description,y
"* This position is on the Data Analytics team, Remote - Anywhere in the US *
* THIS POSITION REQUIRES A COVER LETTER IN ORDER TO DEMONSTRATE EFFECTIVELY THE ABILITY TO COMMUNICATE THE RESULTS OF AN ANALYSIS IN WRITTEN FORM. *
Position Purpose:
Performs moderately complex (journey-level) analytical work. Interprets data. Supports research teams to produce valuable insights from data. Works under moderate supervision, with moderate latitude for the use of initiative and independent judgement.

Essential Responsibilities:
Uses statistical analyses to support interpretation of data from multiple sources and across databases.Assists in developing programs and scripts for data transformation, integration, reduction, and data visualization across multiple data sets.Assists in enhancing existing analytic applications for data coding.Collaborates with others in the organization to meet client and company demands.Participates in special projects and performs other duties as assigned.
Minimum Qualifications

Education
Bachelor’s degree from an accredited college or university in statistics, epidemiology, economics, mathematics or related discipline
Experience
Working with large datasets, preferredWorking with SAS Visual Analytics, Power BI, Tableau, or similar data visualization software, preferred
Knowledge, Skills and Abilities

Some Knowledge of
SAS, SQL, R, Python, or similar analytics softwareHealth care delivery or policy
Proficient Skill in
Prioritizing and organizing work assignmentsThe use of personal computers and applicable programs, applications and systems
Some Skill in
Maintaining effective working relationships with individuals and groups
Ability to
Meet project deadlines across multiple projectsExercise logic and reasoning to define problems, establish facts and draw valid conclusionsMake decisions that support business objectives and goalsIdentify and resolve problems or refer issues appropriatelyCommunicate effectively verbally and in writingAdapt to the needs of internal and external customersShow integrity and ethical behavior; respect confidentiality, business ethics and organizational standardsAssure compliance with regulatory, contractual and accreditation entries
Work Environment
Requires working in an office/cubicle environment; sitting, standing, walking, bending, twisting and/or reaching. Requires repetitive movement; ability to lift, carry or move up to 25 lbs. when transporting work equipment or materials. May require ability to operate a motor vehicle; the ability to travel by motor vehicle and commercial airline. May require overnight travel.",0
"Facebook's mission is to give people the power to build community and bring the world closer together. Through our family of apps and services, we're building a different kind of company that connects billions of people around the world, gives them ways to share what matters most to them, and helps bring people closer together. Whether we're creating new products or helping a small business expand its reach, people at Facebook are builders at heart. Our global teams are constantly iterating, solving problems, and working together to empower people around the world to build community and connect in meaningful ways. Together, we can help people build stronger communities - we're just getting started.

Messenger remote presence infra team powers audio and video calling for millions of users. This is a real time calling infrastructure for Messenger, Instagram, Workchat and Portal. We are looking for Data Scientists with deep knowledge in infrastructure systems to join us.Some of the key questions you will be working on: Systematic understanding of media stack of infrastructure with data, quantify media quality and explore how media quality affect user engagement; improving networking stack and working on cutting edge technology to make remote experience more real time and fun. With this role, you can learn a lot of skills to make you an awesome DS: dive deep into tech stack of infra, experimentation (A/B testing), operational support. There is a good balance between diving deep on technical side as well as influencing engineering leaders on this role - data scientists are the key partner to deliver insights and uncover opportunities and drive engineering roadmap on the team. Team is based in Bellevue.

Build long term product vision and strategy and scope out the area for the team
Generate product ideas that affects millions of users to connect real time
Understand the complex E2E real time infrastructure system and identify the bottlenecks and opportunities
Build and validate the hypothesis of product ideas and infrastructure improvements
Leverage data to inform the right business decision, such as designing how to evaluate the product performance and whether they should be launched

5+ years of hands-on data science experience, Data analysis skill, willing to get your hands dirty with data
Expert knowledge of SQL, Python, R
Experience on working with multiple cross functional partners and influence decision making based on data
Experience initiating and drive projects to completion with minimal guidance
Experimentation- AB testing

Facebook is proud to be an Equal Opportunity and Affirmative Action employer. We do not discriminate based upon race, religion, color, national origin, sex (including pregnancy, childbirth, or related medical conditions), sexual orientation, gender, gender identity, gender expression, transgender status, sexual stereotypes, age, status as a protected veteran, status as an individual with a disability, or other applicable legally protected characteristics. We also consider qualified applicants with criminal histories, consistent with applicable federal, state and local law.
Facebook is committed to providing reasonable accommodations for candidates with disabilities in our recruiting process. If you need any assistance or accommodations due to a disability, please let us know at accommodations-ext@fb.com.",1
"Data Engineer III

Formerly the Mental Health Association of New York City (MHA-NYC), Vibrant Emotional Health’s groundbreaking solutions have delivered high quality services and support, when, where and how people need it for over 50 years. Through our state-of-the-art technology-enabled services, community wellness programs, and advocacy and education work, we are building a society in which emotional wellness can be a reality for everyone.

Tired of AdTech and FinTech? Use your skills to improve mental health services and save lives! As a Data Engineer at Vibrant, you will report to the Senior Data Scientist. You will use statistical data analysis, visualization, quantitative research, and data programming to support operational reporting and analytical needs and to tell the story of our work for senior executives, funders, partners, clients, and the public, using data visualizations and analysis.

Essential Duties and Responsibilities:
 You will produce or supervise the production of:
Data analysis, visualizations, and research that tell the story of our work, including operational performance and mission impact, for internal and external stakeholders.
Network performance analysis and visualizations highlighting call/text/chat contact volumes, response rates, abandonment and related operational performance metrics.
Data-wrangling and pipeline processes, using AWS Lamda, Python, R, Rstudio, Shiny, AWS DMS, Postgres, and similar toolsets.
Under the supervision of the Chief Data Scientist, working with the Software Dev team, and business unit stakeholders, you will..
Develop conceptual and logical database models.
Create data pipeline and data-wrangling processes.
Prepare analytical/operational reports and processes.
Develop data visualizations and analysis.
Some on-call and incident response responsibilities.
Other work-related responsibilities as assigned by supervisor.
Knowledge, Skills and Abilities:
Masters-level credentials or demonstrated expertise and aptitude in relevant disciplines (statistics, computer science, NLP)
Expertise in data analysis as demonstrated by a portfolio of projects, experience mentoring or teaching, delivered products, presented or published work
Expertise in data visualization.
Expertise in quantitative research methods.
Expertise in two or more of R, Python, Tableau, D3, SPSS, Postgres, SQL, or other relevant dataviz and stats tools, as demonstrated by completed projects and/or Github examples.
Experience working with data programmers, and knowledge of basic data-wrangling.
We value candidates who have demonstrated commitment to the goal of working with people to achieve mental and emotional wellbeing with dignity and respect.
Experience communicating with domain stakeholders in health or mental health.
Knowledge of fundamental technology practices, such as source management, CI, SCRUM.
Play well with others, and enjoy collaborating with academics, technologists, and advocates in the field of mental health.
Visual literacy and design literacy.
Knowledge of qualitative research methods.
Excellent comprehensive benefits, including medical, dental, vision, supplemental income insurance, pre-tax transit/parking, pre-tax FSA for medical and dependent care, and 401K available. 4 weeks’ vacation, plum benefits, etc.

Vibrant Emotional Health is an equal opportunity employer. Applicants are considered for positions without regard to veteran status, uniformed service member status, race, creed, color, religion, gender, gender identity, sex, sexual orientation, citizenship status, national origin, marital status, age, physical or mental disability, genetic information, caregiver status or any other category protected by applicable federal, state or local laws.",0
"Summary
We exist to help people achieve financial clarity. At Thrivent, we believe money is a tool, not a goal. Driven by a higher purpose at our core, we are committed to providing financial advice, investments, insurance, banking and generosity programs to help people make the most of all they’ve been given.


At our heart, we are a membership-owned fraternal organization, as well as a holistic financial services organization, dedicated to serving the unique needs of our clients. We focus on their goals and priorities, guiding them toward financial choices that will help them live the life they want today—and tomorrow.

Join our newly created Data Office as the full-time Kafka Data Engineer! We are hiring for both a mid-level and a senior level Engineer. Bring your expertise in implementing modern data architectures and Data Streaming. We have a data streaming platform to enable frictionless data flow from business systems and 3rd party sources using publish/subscribe model. This role will require experience with hybrid platforms, cloud migration, publishing, development with newer technologies such as Spring Boot, KSQL/Stream Processing, data connectors such as Kafka, performance tuning, data quality and data visualization knowledge. You and will report to the Director of Information Delivery.

Job Description

Job Duties and Responsibilities
Partner on the design, deployment, and persistence of our new streaming platform unifies the data across organization, using Confluent Kafka.
As the senior level Engineer, you will be leading a group of engineers.
Design, Develop, Release & Support containerized microservices (OpenShift / Spring Boot) to transform and enrich topic data.
Lead reusable design and patterns for services and data processes within the platform.
Partner on setting standards, implementing tools, and creating documentation for self-serve data pipeline services supporting core engineering and professional services use cases.
Work with existing engineering teams to become data producers and consumers to and from Confluent Kafka.
Oversee and direct efforts to identify information and technology solutions that enable business needs and strategies.
Apply business knowledge and experience to effectively advise others on technology as an enabler.
Lead efforts to analyze IT industry and market trends and determine potential impacts.
Develop concepts and constructs necessary to create technology-enabled business systems.
Influence technology direction.
Provides thought leadership and execution to large complex efforts.
Utilize breadth of technical understanding and dive deep when necessary.
Consult on and manage initiatives to ensure alignment across multiple business and IT areas.
Proactively mitigate risks across multiple assets, information domains, technologies & platforms.
Provide leadership, mentoring and technical guidance to others to drive initiatives.
Facilitate communications that involve obtaining cooperation and agreement on issues that may be complex or controversial.
Utilize negotiation and persuasion to come to agreement and to effectively form partnerships.
Act as a change agent to continuously improve and move the organization forward.
Accountable to provide leadership to successfully deliver the right results on initiatives in a timely and effective manner.
Direct the work of others to lead initiatives that cross multiple assets, technologies, platforms, departments and vendors.
Ability to work within a diverse team of skillsets and experience levels to deliver results.
Required Job Qualifications
Bachelor’s degree or equivalent experience in MIS, Computer Science, Mathematics, Business or related field.
5+ years of experience in Technology related field including prior lead experience. For the senior level position require 8+ years of experience including 3+ years of lead experience.
Strong experience with event streaming such as (Kafka or Amazon Kinesis).
Experience with SQL and NoSQL databases (PostgreSQL, MongoDB, etc).
Proficient delivering services within AWS.
Experience with Confluent Kafka, penShift / SpringBoot is preferred.
Demonstrated ability to develop containerized microservices (Docker with Kubernetes) is preferred.
The ability to communicate cross-functionally, derive requirements and architect shared datasets; ability to synthesize, simplify and explain complex problems to different types of audiences.
Desire to show ownership of problems you identify and proven ability to empower others to get more done.

Thrivent provides Equal Employment Opportunity (EEO) without regard to race, religion, color, sex, gender identity, sexual orientation, pregnancy, national origin, age, disability, marital status, citizenship status, military or veteran status, genetic information, or any other status protected by applicable local, state, or federal law. This policy applies to all employees and job applicants.
Thrivent is committed to providing reasonable accommodation to individuals with disabilities. If you need a reasonable accommodation, please let us know by sending an email to human.resources@thrivent.com or call 800-847-4836 and request Human Resources.",3
"Who We Are

At Cross River, we are building the best banking and technology products for fintechs, all through APIs. As venture-backed pioneers of the platform-based financial services model known as the sponsor, or partner, bank, we work closely with our partners to offer products such as payments rails and loan origination services to the latest in regulatory and compliance solutions. What drives us every day? A desire to innovate in the service of financial inclusion. Giving access to consumers, whether they are looking for credit or for a better way to pay has been in our DNA from day one. Our nimble, adaptive, one-step ahead culture is powered by our people, their creativity, tech-forward thinking, and collaborative spirit, we are experiencing explosive growth.

What we are looking for

Cross River's Technology team is made up of problem solvers hungry to perfect new products and systems. As SQL Developer, you play a key role. In this role you will focus on SQL reporting. The Technology team cares about results, not activity, and we have fun doing it. If you like challenging problems are analytical, and a great team player—we want to hear from you!

Responsibilities:

Using SQL Server Integration Services (SSIS), Python, C#
Design, develop, optimize, maintain and support ETL processes using data warehouse design best practices and SQL Server Integration Services (SSIS) to integrate data from multiple source systems into a Data Warehouse, cleansing data, transforming and loading data from multiple formats using SSIS and stored procedures
Create and optimize SQL Statements, Procedures and Functions
Modify databases according to requests and perform tests
Solve database usage issues and malfunctions
Liaise with developers to improve applications and establish best practices
Ensure all database programs meet company and performance requirements
Research and suggest new database products, services and protocols
A successful candidate will have hands-on experience in a multitude of domains; including, but not limited to database design, data warehousing, business intelligence, big data, database tuning, application optimization, security, virtual computing and storage, incident tracking, and general database administration
Documenting procedures for all tools / processes you create.

Qualifications:

Working independently or minimal supervision
Proven work experience as a Database developer
5 years' experience with SSIS
Hands on experience with SQL
Knowledge of software development and user interface web applications
Familiarity working with .Net Framework, JavaScript, HTML and Oracle
Excellent analytical and organization skills
An ability to understand front-end users' requirements and a problem-solving attitude
Excellent verbal and written communication skills
BSc degree in Computer Science or relevant field

Preferred qualifications:

Knowledge of Python, Datomic, Hadoop, Big data
Experience with C# .Net development

Cross River is an Equal Opportunity Employer. Cross River does not discriminate on the basis of race, religion, color, sex, gender identity, sexual orientation, age, non-disqualifying physical or mental disability, national origin, veteran status or any other basis covered by appropriate law. All employment is decided on the basis of qualifications, merit, and business need.",3
"By joining Eaton Vance, you’ll become part of a company that has one of the best employee retention rates in the financial services industry. We offer competitive salaries, generous benefits, and tremendous opportunities for growth and development. If you do not see a position that fits your career objectives, please return to this site in the future as our hiring needs will change. We look forward to your becoming a part of our continued success!

Basic Purpose:
The Data Engineer will provide data and data-related services and capabilities to our data science teams and their evolving needs. This person will be organizationally part of IT, reporting to the Investment Technology Product Manager and will be dedicated to data science-related initiatives that the data science teams are prioritizing. As part of the IT responsibilities, the Data Engineer will ensure that the data delivery architecture is consistent with internally defined frameworks. As part of the data science teams’ priorities, the Data Engineer will work to provide fast, iterative results to the team.
Primary Responsibilities:
Assemble and deliver data sets as defined by the business requirements
Implement process improvements
Implement data control mechanisms
Reuse existing internally approved frameworks and propose new solutions where needed
Organize ongoing knowledge sharing and per reviews with the business and IT of work-in-progress and solutions
Work with all stakeholders including Data Architecture, Data Science and Product Management to promote scalable, reusable solutions

Job Requirements:
Undergraduate degree or equivalent experience.
Experience in a Data Engineer role
3+ years of experience Python
3+ years of experience SQL
AWS Cloud Practitioner Certification or equivalent experience with AWS cloud services
A successful history of manipulating, processing and extracting value from large disconnected datasets.
Strong project management and organizational skills.
Experience supporting and working with cross-functional teams in a dynamic environment.
This policy applies to Eaton Vance Corp. and all subsidiary companies (the “Company”).
The Company is an equal opportunity employer and is committed to providing a work environment that is free of discrimination and harassment. It does not discriminate against applicants or employees with respect to any terms or conditions of employment on account of race, color, religion, creed, national origin, ancestry, sex, sexual orientation, age, pregnancy, parenthood, physical or mental disability (actual or perceived), medical condition including genetic characteristics, marital status, citizenship status, military service, gender, gender identity or expression, registered domestic partner status, domestic violence victim status, status with regard to public assistance, or any other characteristic protected by applicable federal, state or local laws. Eaton Vance also prohibits discrimination based on the perception that a person has any of those characteristics or is associated with a person who has or is perceived as having any of those characteristics. This commitment applies to all persons involved in the operations of the Company, and prohibits unlawful discrimination by any employee of the Company, including supervisors and co-workers. All employment decisions shall be consistent with the principles of equal employment opportunity.
The information on this Web site is for U.S. residents only. The information on this Web site does not constitute an offer to sell, or a solicitation of an offer to purchase, securities in any jurisdiction to any person to whom it is not lawful to make such an offer. Eaton Vance does not provide tax or legal advice. Prospective investors should consult with a tax or legal advisor before making any investment decision. © Eaton Vance Management. All rights reserved. Two International Place, Boston, MA 02110",3
"Bind is a health technology and services company founded in 2016 and headquartered in Minneapolis, MN with satellite offices in New York and San Francisco. Bind is health insurance for the way we live now. Unlike traditional health insurance that charges you for services you may never need or want, Bind is on demand: pay for what you need, not what you don't, and adjust your coverage when those needs change. Health coverage that's flexible, clear, and intuitive.
We are creative, collaborative, and a little bit fiery. The Bind team is comprised of like-minded individuals passionate about healthcare, and our cause is the collective act of rewiring it. We embrace new ideas. We're more wheel than cog. More spark than smoke. And we are playful and venturesome in our daily mission to render real and refreshing solutions to health insurance that works better for us all.
Healthcare Data Analyst – San Francisco
Summary
Bind is actively seeking a highly skilled, motivated and experienced Healthcare Data Analyst to build and support the analytics pipeline for Bind working closely with the Data Engineering and Data Science teams. These analytics are to be developed using cloud stored data and deployed to Bind teams (Excel, SQL, BI Tools). The role will also require an understanding and ability to advance data engineering and ETL requirements in service of our analytics interacting with medical and pharmacy claims, provider and clinical quality data. Bind is looking for an analyst who can work with other team members to understand business requirements to develop and execute analytic output and strategy. Focus, enthusiasm and a dedication to excellence are all personal characteristics highly valued in the Bind organization. This role can office out of either Minneapolis or San Francisco.
Responsibilities
Ensure data pipelines and analytics are scalable, repeatable, and secure, and can serve multiple users within the company.Collect, parse, manage, analyze and visualize large sets of data using multiple platforms.Translate business requirements into meaningful and detailed analytics output.Document analytics pipeline using documentation software such as Word/Excel or specialized tools like JIRA.Develop analytics using self-service tools (Looker, Tableau, SQL) and/or coding technologies (Python).
Requirements
Bachelor's degree in Information Technology, Mathematics, Machine Learning, Computer Science, Public Health, Business Analytics, Physics, or a related quantitative discipline required.Minimum of 5 years of related experience.Ability to translate business requirements into deployed analyses.Demonstrated detailed experience with healthcare analytics from at least one of these data sectors (Pharmacy, Claims, Provider, Clinical).Strong experience with SQL.Experience in ETL processing and data engineering preferred.Define, create, and maintain analytic applications.
Experience with JIRA for an SDLC tool, preferred.Experience with Cloud/AWS environments, ideal.Demonstrated expertise troubleshooting complex data questions.Knowledge of the healthcare and health insurance sectors with HIPAA requirements.Exposure to formal software development methodologies such as Agile Methodologies (XP, Scrum), etc.Ability to work well with other teams to resolve issues
Excellent communication and interpersonal skills
Bind is committed to providing equal employment opportunities. All qualified applicants and employees will be considered for employment and advancement without regard to race, color, religion, national origin, sex, disability, age, marital status, sexual orientation, veteran status, genetic information, or any other status protected by applicable law.",0
