description,y
"RMS is the pioneer in the development and application of complex statistical and numerical modeling methods for the quantification of risks due to natural and man-made catastrophes. Our risk models are the most detailed and comprehensive models of catastrophes produced anywhere in the world. Our clients include several hundred insurance and reinsurance companies as well as brokers, banks, hedge funds, regional and local governments, and multilateral agencies. Our models are delivered to our clients through sophisticated software utilizing a range of cutting-edge technologies.

Responsibilities:
Responsibilities will include understanding the mathematical modeling ideas developed at RMS and express them clearly and efficiently within the our software framework which is being built for the next generation RMS’ software platform. A successful candidate will work closely with our core model developers across all our hazard, exposure, and vulnerability teams, in a dynamic and business driven environment.

Qualifications and Skills:

Essentials:

MS in Mathematics, Computer Science or Engineering from a top university.
Excellent programming skills in C# or Java.
Excellent knowledge of the .NET framework
Good knowledge of probability and statistics.
Good knowledge of mathematical modeling.
Substantial experience in developing scientific applications with such tools, especially for use in a Cloud environment.
Excellent communication and prioritization skills.
Desirables:

PhD preferred
Possess an analytical mindset and strong programming skills in a Linux/Unix environment.
Experience working on large data sets in such an environment.
Experience working with relational databases such as SQL Server, MySQL, as well as using NoSQL databases such as MongoDB, Cassandra, HBase.
Understanding of Software Development Life Cycle processes, as well as Agile development methodology.

About RMS
There’s a 1% chance an earthquake will cause $50 billion of insured loss within the next 12 months and a 5% chance that a hurricane will cause $60 billion of insured losses next year. At RMS, we turn risks into real numbers. How? By building simulation models that allow insurers and investors to understand and manage their global risks-from hurricanes, quakes, and wildfires, to cyberattacks, terror attacks, and pandemics. Why? We want to build a more resilient world, and we’re on a mission to help make every risk known.
Insurers, reinsurers, investors, financial institutions, governments, and NGOs trust RMS solutions to better understand and manage catastrophe risks. RMS was founded in 1989 by Stanford scientists who created our first model for California Earthquake. Today, RMS has some 1,300 employees across 13 offices in the US, London, Bermuda, Zurich, India, China, Japan, Singapore, and Australia, and over 1,000 products and models now covering six continents.
RMS helped pioneer the natural catastrophe model market we now lead – and we continue to innovate. In May 2019, we announced RMS Risk Intelligence™ (RI), an open-standard platform for strategic risk management. Through this purpose-built platform, clients can tap into RMS HD models, rich data layers, intuitive applications and APIs that simply integrate into existing enterprise systems to support business decisions across underwriting, risk selection, mitigation, and portfolio management.
How we understand and manage risk affects everyone and our passion is nothing less than creating a more resilient world through a better understanding of catastrophic events. Join our team of leading scientists, developers, industry experts, and world-class professionals. Together, RMSers make a difference on a truly global scale.
Visit RMS.com to learn more and follow us on LinkedIn and Twitter.
RMS is proud to be an equal opportunity workplace. We are committed to equal employment opportunity without regard to race, color, creed, gender, religion, marital status, registered domestic partner status, age, national origin or ancestry, physical or mental disability, genetic characteristics, sexual orientation, or any other classification protected by applicable local, state, or federal law.
To all recruitment agencies: RMS does not accept unsolicited agency resumes and will not be responsible for the payment of placement fees related to unsolicited resumes submitted to open positions, job aliases, or to our employees.
California Consumer Privacy Act notice: https://www.rms.com/legal#Privacy-Policy-ccpa
US Applicants: RMS is enrolled in E-Verify® and will be participating in E-Verify in addition to using our Form I-9 process. www.dhs.gov/E-Verify",1
"**Global Dimensions is submitting a proposal to bid for award on this contract. If you are interested in applying for employment upon award, please submit your resume. We will ask qualified candidates to sign a Letter of Interest, which is not a commitment of employment, but states you are interested in future work under this contract.**
Deliver products (by uploading documents to USG servers) developed under this PWS and assist in ensuring that they are available to the greater US IC
Conducts data analytics, data engineering, data mining, exploratory analysis, predictive analysis, and statistical analysis, and uses scientific techniques to correlate data into graphical, written, visual and verbal narrative products, enabling more informed analytic decisions
Proactively retrieves information from various sources, analyzes it for better understanding about the data set, and builds AI tools that automate certain processes
Creating various ML-based tools or processes, such as recommendation engines or automated lead scoring systems
Performs statistical analysis, applies data mining techniques, and builds high quality prediction systems
Assist in developing and maintaining a web site that is accessible by all the IC members and the various branches of the Army
Perform web-based database design, implementation, and maintenance for the CI Common Operating Picture (COP) and the intelligence web pages
Create and develop computer software configuration documentation, user manuals, and provide one-on-one consultation to the branch chiefs and senior analysts
Update and maintain the classified intelligence websites on Intelink and Intelink-S and associated systems; including: posting data, providing information and responding to documentation for activities such as RFI, Requests for Assistance (RFAs) and Request for Products (RFPs) on a daily basis
Assist with monitoring the status of classified requests, such as RFI, RFAs and RFPs, and provide weekly updates
Provide dedicated page design, development, and integration of information to web-based presentations for the Army’s Secret Internet Protocol Router Network (SIPRNet) and Joint Worldwide Intelligence Communications System (JWICS) web sites
Conduct coordination with internal and external information technology service providers to help maintain and improve the sites
Requirements
US Citizen
Active TS/SCI security clearance
Skilled in data visualization and use of graphical applications, including Microsoft Office (Power BI) and Tableau; major data science languages, such as R and Python; managing and merging of disparate data sources, preferably through R, Python, or SQL; statistical analysis; and data mining algorithms
Prior experience with large data Multi-INT analytics, ML, and automated predictive analytics
At least two years of experience in website coding, basic graphics techniques, Structured Query Language (SQL), Hypertext Markup Language (HTML), Extensible Markup Language (XML), Java, Java Applets, and JavaScript
Security Plus certified
Qualified at Information Assurance Technical Workforce Requirement Level II
High School Diploma: 20 years of relevant experience with at least a portion of the experience within the last 2 years
Associates Degree: 16 years of relevant experience with at least a portion of the experience within the last 2 years
Bachelors Degree: 14 years of relevant experience with at least a portion of the experience within the last 2 years
Masters Degree: 12 years of relevant experience with at least a portion of the experience within the last 2 years",0
"Pinnacol Assurance does just one thing, and does it better than anyone: provide caring workers' compensation protection to Colorado employers and employees. And while we may be a little biased, we believe that our work shapes communities and changes lives.

We have big hearts and love big ideas. We celebrate continuous improvement, innovation, compassion, teamwork, integrity and excellence. Speaking of celebrating, we love having fun at work. We host holiday parties, on-site painting classes, and employees love our yoga classes and book club, too.

What you'll do:
You will work with medical, claims, and policy related data that comes in a variety of formats – structured and unstructured - to generate insights and embed artificial intelligence into applications. As a Data Scientist, you will work with internal teams to:


Extract and clean data from various sources
apply tools and methods to transform or enrich data for an array of possible uses
build creative solutions for a variety of problems of interest to our company
Ability to thrive in a fast-paced environment and enjoy working closely with a core data science team
Build collaborative working relationships with both technical and business team members from a variety of teams and backgrounds
Share knowledge and communicate complex concepts effectively to both technical and non-technical team members and leaders
Enthusiastically seek out opportunities to grow both your domain and technical knowledge
Devise creative approaches for leveraging incomplete or noisy data to build intelligent and/or automated solutions for decision-making and analysis
Create effective technical documentation, charts, graphs, and analyses to support operationalizing and maintenance of solutions and products
Support team members in the maintenance of systems for production environments and resolution of internal and external customer issues

What you'll bring to the table:
Bachelor's degree in Data Science, Machine Learning, Computer Science, or other quantitative field. Master's degree preferred. Relevant work experience (similar kind of work at a similar level of work) may be substituted for a Bachelor's degree. Completion of a degree is encouraged and supported.


Strong programming skills. Preferred languages: Python, SQL,Bash
Experience with common data science libraries (e.g. spaCy, Pandas, NumPy, Scikit-learn, XGBoost, Tensorflow, PyTorch, Keras)
Experience in extracting, cleaning, preparing, and modeling data; command-line scripting, data structures, and algorithms
Two or more years of experience working with insurance data (e.g. medical records, insurance claims, policy data) preferred
Familiar with fundamental concepts, practices, and principles of software and API development, version control, containers, and scalable infrastructure/platforms
Proficiency using cloud environments; preferred experience in Google Cloud Platform

We can't do our work without people like you.
Our employees are extraordinary and committed to making a difference. Here's some of the ways we show our appreciation.
-----------------------------------------------------------------------------------------------------------------------------


Our benefits go beyond the basics. You'll get to choose from diverse benefit offerings for medical, dental and vision.
We care about each other. We enjoy a positive, collaborative work environment. We are hard workers and high performers.
Take a day (or 20!) off. Enjoy 20 paid days off your first full year plus eight paid holidays annually.
Take care of yourself. Sign up for unique wellness programs, including on-site, company-paid fitness facilities and classes
Get your learning on. We promote a learning culture to help you master your current job and cultivate the skills of the future through a variety of on-site, online, and off-site professional development opportunities.
Give back and get paid. Through our employee volunteer program, Pinnacol in Action, employees receive paid time off to volunteer with Colorado nonprofits.
Share in our success. You'll have the opportunity to earn a quarterly incentive, up to 20 percent of your annual base salary, when your team exceeds their goals and objectives.

When we find the right person, we try to put our best foot forward with an offer that excites you. We consider what you'd like to be paid, what similar jobs pay in the Denver area and make sure there's equal pay for equal work among those you'll be working with.

Want to love your work? Apply today!",1
"We are looking for a Artificial intelligence and Machine Learning (ML) Engineer with expertise in continuous learning methods.If you enjoy creating machine learning models and containerized retraining systems with your exceptional in statistics and programming, this is the best job role for you. If you also have knowledge of data science and software engineering, we’d like to meet you.Your ultimate objective will be to train and build efficient self-learning applications.ResponsibilitiesUnderstand the problem and evaluate the best possible approachUnderstand data type, scenarios and best practice to clean and imputeCreate and transform data science prototypesDesign machine learning systemsResearch and implement appropriate AI and ML algorithms and toolsShould be well versed with ML libraries available on cloud platforms like AWS, GCPDevelop machine learning applications according to requirementsSelect appropriate datasets and data visualization methods with R/ PythonRun machine learning tests and experiments to find best algorithmPerform EDA, feature selection, dimensionality reduction and parameter-tuning using test resultsTrain and retrain systems when necessaryExtend existing ML libraries and frameworksShould keep yourself continuously upgraded with the new algorithmsKey ActivitiesDesigning and developing Artificial intelligence machine learning systemsRunning machine learning experiments and testsImplementing appropriate ML algorithmsRequirementsProven experience as a Machine Learning Engineer or similar roleUnderstanding of data modeling, data structures, data types and software architectureVery good knowledge and hands-on experience on math, probability, statistics and algorithmsExperience identifying patterns in the dataShould have worked on: Tree based models, SVM, gradient boosting, optimization algorithms, clustering, bagging and boosting, feature selection, random forest, image analysis, sentiment analysisAbility to write robust code in Python, Java and RProven experience with: textblob, nltk, pandas, numpy sckit , tensorflow and other ML librariesFamiliarity with machine learning frameworks (like Keras or PyTorch) and libraries (like scikit-learn)Should know version control systems and good knowledge on any one of the standard IDE (xcode, vscode, pycharm etc)Excellent communication skillsGreat to have AWS certificationAbility to work in a teamOutstanding analytical and problem-solving skillsBS in Computer Science, Mathematics, statistics or similar field; Master’s degree is a plusApplicants for employment in the US must have valid work authorization that does not now and/or will not in the future require sponsorship of a visa for employment authorization in the US.ABOUT USAt HGS Digital, our vision is to be the globally preferred digital transformation partner for our clients, creating value in their business through rigorous innovation at scale. We are an expert team of 800+ leading strategic thinkers, digital marketing and creative masters, data analysts, software engineers, and process optimization specialists with an elemental desire to create transformative digital solutions.HGS Digital aims to be the top facilitator for leading disruptive change in the consumer journey and transforms organizations into digital innovators by combining deep domain expertise in customer care with digital analytics, marketing technology and advanced technologies like cloud, intelligent automation and artificial intelligence.The innovative team of HGS Digital, part of parent group Hinduja Global Solutions Ltd. (HGS), serves from multiple locations in US, UK, India & Philippines, and work with our clients around the globe.Benefits:Vision careVacation & paid time offExtended health careJob Type: Full-timeSalary: $85,000.00 to $110,000.00 /yearExperience:Machine Learning: 4 years (Required)Python, Java : 5 years (Preferred)",2
"Company Overview:
Integrated Data Services, Inc. (IDS) is a leading provider of custom software products and Government financial management services. IDS was founded in 1997 in El Segundo, CA, and since that time has seen tremendous growth and success. Currently IDS has offices supporting customers nationwide. By providing customers with fast, efficient and reliable information systems and support services, IDS has become a preferred provider of financial and programmatic systems, services, and solutions across a wide variety of government agencies.
Position Description:
IDS is seeking a Data Engineer/Architect with expertise in data modeling, data warehousing, data governance, data integration, data analytics and data visualizations. This position will support, enhance and streamline existing data integration processes. This position will architect how structured and unstructured data will be stored, consumed, integrated and reported by different systems across internal and external data sources. This position will work towards building an enterprise model, a central dictionary of common business vocabulary, define approach & principles for data quality management, master data management, data integration, data security/access and data archiving & retention. In this role the person is also expected to be well versed in creating/maintaining/reverse engineering data models that enable the understanding and documentation of data standards, metadata and entity & domain relationships and the flow of data across business applications. We are looking for an ambitious self-starter with proven technical and analytical capabilities and the tenacity to develop ideas independently and thrive in a fast-paced environment. This role is for a technologist who loves to roll up their sleeves, dive in, and tackle any problem with speed and precision.
Responsibilities include, but are not limited to, the following:
Engineer and implement extract, transform and load (ETL) processes using Talend and PL/SQL.
Design and develop RESTFUL API interfaces using the OpenAPI specification and the Apigee Edge API Management Platform.
Define the strategy and architecture required to integrate data across multiple systems, improve the existing data warehouse architecture and support our transition to AWS.
Implement and optimize physical database design to support performance, scaling, security, backup, and disaster recovery requirements.
Creates and enforces technology-specific guidelines, standards, policies and procedures
Work closely with application developers and data analysts to design and optimize data access, query, reporting, and analysis strategies.
Communicate with the Product Management and development teams to raise issues and identify potential barriers in a timely fashion.

Knowledge and Skills:
This position requires a minimum of 5 years of experience as a data engineer or architect.
This position requires a minimum of 5 years of experience developing ETL or ELT solutions.
This position requires a minimum of 5 years of experience with Oracle SQL and PL/SQL.
This position requires a minimum of 3 years of integrating DoD contracting, acquisition, financial management, program management, logistics management, manpower/personnel management or related data within a DoD organization.
Candidates with Talend and Apigee experience are preferred.

Education and Work Experience:
This position requires a minimum of a Bachelor's degree from an accredited college or university in business management, engineering, computer science, mathematics, accounting, economics or other related discipline.
Experience in lieu of education may be considered if the individual has seven (7) or more years equivalent technical training or work experience.

Certificates and Licenses:
Applicants selected for employment will be subject to a Federal background investigation and must meet additional eligibility requirements for access to classified information or materials.

Travel:
Some travel may be required.

Hours:
Normal work schedule will be 8:00 A.M. to 5:00 P.M., Monday through Friday. May be required to work additional hours and/or weekends, as needed, to meet deadlines or to fulfill travel obligations.

Salary Range:
Commensurate with experience.

IDS offers a robust benefits package including health, dental, vision and 401K plans. IDS is an Equal Opportunity Employer and all qualified applicants will receive consideration for employment without regards to race, creed, age, sex, gender, physical or mental disability, sexual orientation, gender identity, gender expression, ancestry, pregnancy perceived pregnancy, medical condition, marital status, familial status, color, religion, uniformed services, veteran status, national origin, genetic information, or any other characteristic protected under local, state or Federal law. A submission of a resume is an expression of interest and not considered an application.
For more information, visit www.get-integrated.com.

**U.S. citizenship and/or green card is required; H1-B visas and other visas are not being sponsored. Relocation expenses are NOT compensated. All jobs are employer paid; no fees to candidates. Third parties or agencies inquiries are not being accepted.**

#IDS",3
"Crossix is a health-focused technology company dedicated to advancing healthcare marketing with analytics and innovative planning, targeting, measurement, and optimization solutions. Positioned at the center of big data, innovative technology, and multichannel media, Crossix, a Veeva Company, provides our clients with insights to help make strategic business decisions and drive improved patient outcomes. Crossix knows that our employees are integral to our success, which is why we have created an inclusive culture where everyone can thrive. Crossix is headquartered in midtown Manhattan with opportunities to work in our NYC office and other locations around the country. Along with competitive salaries and benefits, we invest in opportunities for professional development and career growth, and provide other amenities like a beautiful rooftop, team bonding activities, etc.

Crossix is seeking intellectually curious, resourceful, and collaborative Senior Data Scientists to join the Veeva Data Cloud team. This is an excellent opportunity to help us build the technology and data science products that power Veeva Data Cloud and be at the forefront of innovation in the healthcare technology space.

The team is guided by its core values as it works to solve the most challenging problems in healthcare data and analytics:

Singular Focus
Speed
Humility
Ownership
Challenge
What You'll Do
Apply machine learning, data mining, and statistical analysis techniques to large health data sets to build new products and methodologies
Own responsibilities related to project and people leadership, including leading data scientists and analysts
Collaborate closely with a team of data scientists, product managers, and executives to discover and deliver product offerings from prototype to massive scale
Explore and find meaning in high volumes of data to evaluate data quality and extract actionable insights that will help drive business decisions; execute data querying, data cleansing, and experiment design
Rapidly build prototype product solutions, communicate findings, and iterate
Draw from prior experience and technical expertise to identify product improvements and inform testing plans; break overall objectives down into underlying problems that can be prioritized and solved
Work with product and engineering teams to improve and implement methods and features
Master core parts of the Crossix technology platform. Technologies include Spark, SQL, Python, R, AWS, and proprietary data mining software
What You've Done
7+ years of hands-on data science experience, demonstrating increasing responsibility and impact over time, including experience leading projects
Advanced and in-depth knowledge and professional experience in machine learning and statistics
Highly proficient in Python and SQL; experience working with AWS preferred
Strong organizational, management and leadership skills
Strong communication skills and agility to work across internal teams
Who You Are
Have a desire and preference for working in a fast-paced, entrepreneurial environment
Enjoy having clear ownership of a goal even if the path to get there is not entirely clear
Have a curiosity to figure out new problems
Are humble and truly think about the success of the group before your own contribution
Are comfortable challenging existing norms, thinking and teammates, always doing so respectfully
Perks & Benefits
Flexible PTO
Allocations for continuous learning & development
Health & wellness programs
If this role and our exciting company culture seem appealing to you, please apply! We want to continue to grow our diverse team of hardworking and humble people who are passionate about their work. We hope that’s you!",1
