description,y
"RTI is hiring a Research Data Scientist to support our Center for Health Data Analytics. This role will be located in any one of the following RTI locations: Waltham, MA; Research Triangle Park, NC; Washington, DC.

This role provides a unique opportunity for a candidate with strong analytic and healthcare data experience, and equally strong communication and strategic planning skills, to shape and strengthen RTI’s Center for Health Data Analytics (CHDA) public health and clinical informatics capabilities and project portfolio.

CHDA staff provide analytic development and statistical programming expertise to transform expanding and diversifying data sources into meaningful evidence. Our experienced team of over 40 research programmer/analysts identify, extract, structure and link complex, multi-source healthcare data to be analysis-ready, to address research questions across the population health and health services research spectrum.


We are expanding our analytic capabilities to build and support a portfolio of public health and clinical informatics projects, and to strengthen our natural language processing and predictive modeling capabilities. We are seeking candidates with technical, analytic, content and planning experience with the same, to shape and support this expansion.
Duties and responsibilities to include, but not limited to;

This role requires a blend of data and analytic expertise, coupled with strategic planning experience around business development, project portfolio development, and identifying/building cross-organizational collaborations.
About half to two-thirds of this role will include project contributions across an array of healthcare and informatics projects. Project work will include research question design, analytic plan development, and data analysis and model-building using traditional (e.g., claims) and emerging (e.g., semi- and unstructured EHR streams, wearables) healthcare data sources.
The remainder of this role will include working closely with the CHDA Director and other senior staff to contribute to strategic planning efforts to expand staff analytic capabilities around natural language processing and predictive modeling, and planning efforts to expand our portfolio of informatics projects requiring application of these capabilities.
This role will contribute to proposal writing, business development and client management, that will increase over time.
Required Education/Qualifications:

Masters degree or higher in biomedical informatics, epidemiology, biostatistics, quantitative social or natural sciences, public health and/or computer science.
Six or more years applied experience across the following technical, analytic, data and content areas:
Technical software/platform: one or more of: SAS, SQL, R, Python, Stata
Analytic: analytic file creation, natural language processing and analysis of semi- and unstructured clinical data, predictive modeling (traditional and machine learning)
Data: analysis and linkage of large, complex, transactional and relationally-structured healthcare data (e.g., insurance claims, EHR clinical/financial/event log, disease registry, consumer/patient wearables, etc), including semi-structured and free-text clinical data
Content: strong understanding of how and where healthcare data are created, their flow through various entities and systems, and effects of this on curating and analyzing these data for secondary-use purposes (e.g., research, population/public health surveillance); experience with medical coding systems and taxonomies (e.g., ICD-9/10, CPT, HCPCS, NDC)
Strong oral and written communication skills, with demonstrated history of: (Proposal writing, scope of work development, and other business development activities, Professional conference and/or journal contributions)
Ability to work creatively and flexibly in a team environment, with experience identifying and constructing multi-disciplinary, collaborative project teams to tackle novel analytic problems
Must be legally authorized to work in the United States and should not require now, or in the future, sponsorship for employment visa status.
Must have lived in the United States for at least 3 of the past 5 years.",0
"In order to be considered, you must apply via the following link. Please follow the link, and submit to our system.https://rew21.ultipro.com/REA1008/JobBoard/ListJobs.aspxRealty Income, The Monthly Dividend Company®, one of four San Diego based S&P 500 companies dedicated to providing shareholders with dependable monthly income. Our company is structured as a REIT, and its monthly dividends are supported by the cash flow, over 6,000 real estate properties owned under long-term lease agreements with regional and national commercial tenants. To date, our company has declared over 600 consecutive common stock monthly dividends throughout its 50-year operating history and has continually increased the dividend since Realty Income's public listing in 1994 (NYSE: O). Our company attracts individuals who value integrity, perseverance, and teamwork. If you appreciate working on a truly collaborative team in a professional environment in a company that encourages a work-life balance, make sure to apply today!As Realty Income’s Data Scientist, you will be a ground-breaking leader who works as part of a team that builds and owns analytics-based assets, bringing the value of real estate predictive analytics to our business leaders. You will shape the future of a data-savvy organization, in part by driving processes for data extraction and analysis, and by creating new lines of thinking within our core real estate and investing business. In this role, you will design, develop and execute predictive analytics work streams that serve as the catalyst to increase ROI for the business.Your Contribution to the Team IncludesPredictive AnalyticsBuild predictive analytics for use cases such as: Portfolio Management; Development; AcquisitionsWork with business teams to identify, develop and deliver new use cases over timePrioritize predictive analytics initiatives based on multiple factors, e.g., ROI/productivity, business continuity, ease of deliveryDeliver insights with user friendly end-products such as web-based tools, reports (e.g., Power BI) or visualizations that are accessible and understandable for business usersEnsure we remain state of the art by keeping up on the latest technologies and approaches, attending conferences or other events as neededInfrastructure for Predictive AnalyticsCreate the vision for static and dynamic data architecture for predictive analytics encompassing internal data in our ERP system or other data sources as well as externally sourced data (e.g., census information news feeds)Oversee the process for data management leveraging IT and business teams using clearly articulated responsibility matrices and timelines, including meeting internal audit requirements for data/process integrityCoordinate with the IT team to buy or license required tools, data and feedsWork with the IT team as they set up the necessary infrastructure and processes to support predictive analytics, e.g., ETL from the ERP system to data warehouse/lakeDetermine how and when to take and store “snapshots” of data so that we can go back in time to test new models and approachesOrganizational RelationshipsWork closely with business teams, IT, internal audit and enterprise risk to define end products and processesCreate cross-functional working groups or teams as needed to initiate, approve or complete workUpdate the Investment Committee monthly or quarterly on key matters such as portfolio riskSupport business teams in the achievement of their objectives using predictive analytics toolsPerforms other duties as assigned.What You’ll Need to be SuccessfulPhD or advanced degree preferred in a relevant discipline, e.g., machine learning, statistics, applied mathematics, econometrics, or operations research3-5+ years of experience providing advanced analytics within a business settingPrior work experience within real estate or financial services is preferred, but not requiredProgramming experience in Python, Spark and SQL. Java/Scala is a plusExperience with RDBMS systems like PostgreSQL and NoSQL systems like MongoDBHands-on experience in Microsoft Azure and Amazon EC2 cloud platformDemonstrated ability to design and implement ETL workflows across both Windows and Linux environmentsAbility to clearly communicate ideas, orally or via written communicationsMust be authorized to work for any employer in the US without restrictionIn order to be considered for employment, please make sure to follow the link at the top. Resumes emailed, will not be considered.In response to COVID-19, Realty Income has maintained our business operations and have open opportunities, yet made necessary adjustments to our hiring process. We are conducting all steps of the interview process in a virtual capacity. In response to California’s Stay at Home order and other states with similar provisions, our employees will continue to work remotely until these restrictions have been lifted and it is safe to work in an office again. Realty Income has endeavored to be adaptable and strategic in our capacity to maneuver in an unfamiliar situation, and we pride ourselves on our resilience. We immensely appreciate both your flexibility and consideration of Realty Income for employment.To all recruitment agencies: Realty Income does not accept unsolicited agency resumes. Please do not forward resumes to our job’s alias, Realty Income employees, or any company location. Realty Income is not responsible for any fees related to unsolicited resumes.Job Type: Full-timeBenefits:Health insuranceDental insuranceVision insuranceRetirement planPaid time offFlexible scheduleParental leaveSchedule:Monday to FridayWork Remotely:Temporarily due to COVID-19",1
"We are looking for a Senior Data Engineer to join our growing Software Engineering organization. As a member of our growing Data Engineering team, you’ll use cutting edge AWS technologies and leverage your experience with data and data technologies to build out our fast-growing data and analytics platform that serves both our internal team members and our customers. We’re looking for someone who is passionate about data, databases, and all things in between and can bring their experience around best practices and effective technology approaches for moving, assembling, and creating value with data within a cloud-based SaaS platform.
What you’ll be doing:
Develop ETL to populate data lake using Glue / Spark
Develop streaming data pipelines using Lambda, Python, and Amazon Kinesis
Create data extracts to support internal reporting, analytics, and machine learning initiatives
Develop, maintain, and support customer facing analytics data model, including data extracts and data API
Performance tuning and maintenance on ETL and streaming pipeline processes
Mentor other team members on best practices
Participate in team-based knowledge sharing opportunities and contributing to the overall growth of the collective knowledge of Total Expert’s Data Engineering team
Requirements
Enthusiasm to work within a startup where every day can be a new adventure
5+ years of experience developing with Big Data and data streaming technologies in a team-based environment
3+ years of experience with AWS data tools and technologies including Glue, Athena, S3, Lambda, and Redshift
2+ years Python experience
Experience building data warehouse dimensional models for ease of use and performance
Expert SQL knowledge
Bachelor’s degree in Computer Science, Software Engineering, Information Technology or related field
Team based Agile/Scrum development experience using tooling such as Jira, Git, etc.
Benefits
Big Company Benefits, Startup Lifestyle
We believe that living a balanced life leads to more creativity and productivity. Here’s what you and your family get for helping us build what’s next.
Physical Wellness:
Medical Coverage
Prescription Drug Coverage
Dental Coverage
Vision Coverage
Health Club Membership
Health Advocate Program
Flexible Time Off Program
Financial Wellness:
Health Savings Account Flexible Spending Accounts Disability Protection
Life & Voluntary Life Coverage Voluntary Benefits
Pet Insurance
401(k) Retirement Savings Plan
Employee Referral Bonus
Perks:
Lunch delivery stipend
Complimentary snacks and beverages
On-site, covered parking
Professional development opportunities, including training and educational conferences
Company and team outings, such as Twins games, boat rides, etc.
Monthly birthday and anniversary celebrations
About us:
At Total Expert, we strive for excellence, innovation and customer success in everything we do. We are determined to reimagine the way people and technology work together so that we can allow our customers to build more meaningful, human connections with their customers.
Simply put, we believe that we are all a part of building something awesome and are committed to creating a world-class team and culture to do it.
In 2019, Total Expert made the Inc. 500 list of fastest-growing companies in the country at spot #105 and was the second fastest-growing Minneapolis-based company on the list. In addition to being awarded a Top Workplace by the Minneapolis-St. Paul Star Tribune (2018, 2019), we have also been recognized as a HousingWire Tech100 and Minne Inno 50 on Fire award winner in 2019.",3
"Overview:

Wells Fargo technology teams drive innovation to create a more powerful and fulfilling financial experience for our customers and team members. You will join more than 24,000 team members supporting 95 billion transactions annually in 10 countries. Our career opportunities span the technology spectrum: advanced analytics, big data, information security, application development, cloud enablement, project management and more.

SUCCESS PROFILE

Check out the top traits we're looking for and see if you have the right mix. Additional related traits listed below.

Analytical
Detail-oriented
Insightful
Inventive
Problem Solver
Curious
Benefits

Wells Fargo wants to help you get more out of life and take care of things outside the office to make life a little easier. We provide:

Medical, Dental and Vision
Employer Matching 401(k)
Tuition Reimbursment
Maternity and Paternity Leave
Paid Time Off
Responsibilties
Job Description

Important Note: During the application process, ensure your contact information (email and phone number) is up to date and upload your current resume when submitting your application for consideration. To participate in some selection activities you will need to respond to an invitation. The invitation can be sent by both email and text message. In order to receive text message invitations, your profile must include a mobile phone number designated as “Personal Cell” or “Cellular” in the contact information of your application.
At Wells Fargo, we have one goal: to satisfy our customers’ financial needs and help them achieve their dreams. We’re looking for talented people who will put our customers at the center of everything we do. Join our diverse and inclusive team where you’ll feel valued and inspired to contribute your unique skills and experience.
Help us build a better Wells Fargo. It all begins with outstanding talent. It all begins with you.
This role is a part of DMI’s Enterprise Analytics Team – the central analytics group tasked with solving high-impact business challenges and standing up cutting-edge analytical capabilities to be shared across Wells Fargo’s analytic community.
We are looking for a high performer to join our team and help us solve challenging and interesting business problems through rigorous data analysis and predictive modeling. In this foundational role, you will support Customer Genome program. This initiative is focused on creating analytically derived insights to inform development of personalized customer experience and marketing programs. As part of the core Customer Genome team, you will collaborate with other data scientists to generate innovative ideas, define analytical needs, create hypothesis, conduct data discovery, data wrangling, and exploratory data analysis, evaluate data quality, and prepare datasets for building statistical models and machine learning algorithms. You will also help training, testing and deploying machine learning models.
Key Responsibilities Include:
Extract, transform and load data from multiple databases, validate integrity and prepare modeling datasets.
Understand business context of the data and perform in-depth exploratory data analysis (EDA) and present data discovery results and findings with business partners and others
Provide recommendations to data scientists to support complex predictive modeling projects.
Respond to ad-hoc requests from business partners to conduct data analysis to identify/quantify opportunities or address specific business questions.
Utilize emerging analytical and programming techniques to explore internal and external unstructured and semi-structured data; recommend how these additional data sources can be used to enhance existing data and provide additional insight.
Work with complex databases, conduct in-depth research to gain domain knowledge about the data and identify data issues, and propose solutions to improve data integrity; perform other database-related analyses and projects as requested.
Data Management and Insights (DMI) is transforming the way that Wells Fargo uses and manages data. Our work enables Wells Fargo to empower and inform our team members, deliver exceptional experiences for our customers, and meet the elevated expectations of our regulators. The team is responsible for designing the future data environment, defining data governance and oversight, and partnering with technology to operate the data infrastructure for the company. This team also provides next generation analytic insights to drive business strategies and help meet our commitment to satisfy our customers’ financial needs.

Required Qualifications

8+ years of experience in one or a combination of the following: reporting, analytics, or modeling; or a Masters degree or higher in a quantitative field such as applied math, statistics, engineering, physics, accounting, finance, economics, econometrics, computer sciences, or business/social and behavioral sciences with a quantitative emphasis and 5+ years of experience in one or a combination of the following: reporting, analytics, or modeling
4+ years of SQL experience
4+ years of ETL (Extract, Transform, Load) Programming experience
5+ years of experience with data manipulation, cleansing, and transformation
4+ years of Hadoop experience
2+ years of Python experience
4+ years of Hadoop experience with Spark

Desired Qualifications

Extensive knowledge and understanding of research and analysis
Strong analytical skills with high attention to detail and accuracy
Excellent verbal, written, and interpersonal communication skills
Extensive knowledge and understanding of research and analysis
Excellent verbal, written, and interpersonal communication skills
Strong analytical skills with high attention to detail and accuracy
1 + years of machine learning experience

Other Desired Qualifications

Experience working with big data infrastructure and tools (e.g., Hadoop, Spark, Hive, H2O).
Strong programming skills using SQL, Python with ability to manipulate data for analytical purposes and conduct statistical data analysis.
Knowledge of statistical techniques (e.g., probability, multivariate data analysis, regression, PCA, time-series analysis) and experience using machine learning algorithms.
Exposure to deep learning model deployment will be plus
Exceptional analytical skills with high attention to detail and accuracy; strong acumen proactively diagnosing and resolving data issues to ensure accuracy and completeness.
Prior experience in a role requiring collaboration across multiple functions within an organization, ability to translate and summarize complex data into understandable, actionable information and recommendations.
Proven ability to drive each project to completion with minimal guidance while effectively managing multiple projects at a time, meet deadlines, achieve goals, and work under pressure in a dynamic and complex environment.




Disclaimer

All offers for employment with Wells Fargo are contingent upon the candidate having successfully completed a criminal background check. Wells Fargo will consider qualified candidates with criminal histories in a manner consistent with the requirements of applicable local, state and Federal law, including Section 19 of the Federal Deposit Insurance Act.

Relevant military experience is considered for veterans and transitioning service men and women.

Wells Fargo is an Affirmative Action and Equal Opportunity Employer, Minority/Female/Disabled/Veteran/Gender Identity/Sexual Orientation.

ENT FINANCE",3
"DISQO is a next generation consumer insights platform. We provide the highest quality consumer data to the world's largest market research agencies, analytics companies, and brands. We operate one of the world's largest true consumer insights panels. This data helps our clients understand user behavior, build better experiences, and make better decisions. We utilize cutting-edge technology and innovative, out-of-the-box strategies to collect and analyze insights which help shape the products and services of tomorrow.

This is a great opportunity to join a fun, exciting & highly motivated team and upgrade your skills while creating real impact. We use a modern tech stack and cloud infrastructure. We are not only looking for work experience, but rather the willingness to step up to challenges and the ability to learn quickly.

We believe the best software is written and managed by small teams that know how to make the impossible possible. We use agile software development techniques and modern tools to focus our efforts on solving our business goals. We use OKRs to track everything we do. We deliver early and often. We obsess over our code, architecture and infrastructure and we believe that these practices lead to higher quality products.

Check out the DISQO Developer Blog for the latest from our DISQOTECH team.

What you will do:

Leverage your software development and data engineering skills to impact our business by taking ownership of key projects requiring coding and data pipelines
Collaborate with product managers, software engineers and data engineers to design, implement, and deliver successful data solutions
Define technical requirements and implementation details for data solutions
Design, build and optimize performant databases, data models, integrations and ETL pipelines in RDBMS and NoSQL environments
Maintain detailed documentation of your work and changes to support data quality and governance
Ensure high operational efficiency and quality of your solutions to meet SLAs and support commitment to the customers
Be an active participant and advocate of agile/scrum practices to ensure health and process improvements for your team

What you bring to the table:


5+ years of experience designing and delivering large scale, 24/7, mission-critical data pipelines and features using modern big data architectures
3+ years of Scala
3+ years of Spark
2+ years of experience with AWS data ecosystem (Redshift, EMR, Glue, Athena, ...)
Deep knowledge in various ETL/ELT tools and concepts, data modeling, SQL, query performance optimization
Experience with building stream processing applications using Kinesis or Kafka
Experience with workflow management tools (Airflow, Oozie, Azkaban, Luigi, etc.)
Comfortable working in Linux environment
Ability to thrive in an agile, entrepreneurial start-up environment

Benefits & Perks:

100% covered Medical/Dental/Vision for employee
Equity
Unlimited Vacation
Flexible work hours
Catered lunches 3x a week
Stocked pantry
Happy Hours
Onsite Fitness Program
Discounted Gym Membership
Quarterly Offsites
401K
Life Insurance
FSA
Paid Maternity/Paternity leave
Employee Assistance Program
Travel Assistance Program

DISQO is an equal opportunity employer
Recruiting firms that submit resumes to DISQO without first entering into a written contract will not be entitled to any compensation on candidates referred by that firm.

DISQO Developer",3
