description,y
"YOUR TASKS AND RESPONSIBILITIES

The primary responsibilities of this role, Associate Director Data Engineer, are to:
Provide standard and specific master data and transaction data retrievals to all PV functions, internal and external partners, authorities and the Qualified Person Pharmacovigilance (QPPV) utilizing the global PV database, Oracle Empirica solutions, Business Objects, SAS, Spotfire, internal tools and external databases outside Bayer in order to support product risk/benefit, process, workload and impact analysis;
Advise customers and partners on providing comprehensive demand specifications based on the ability to understand PV and GxP processes, the medical background, PV data and regulations, develop bespoke analytics on different data types such as adverse event reports, quantitative drug safety statistics, workflows, workload and reporting compliance;
Use specific PV tool knowledge, programming and query languages to develop new queries, reports and tools for risk/benefit, process, workload and impact analysis while following software development and computer system validation rules in order to cover new demands with compliant solutions;
Advise on process improvements and develop their tools and representations such as signal management workflows, SOPs, other quality documents and validation activities to increase PV efficiency in a compliant manner, support inspections, their preparations and the PV Inspection Intelligence function with SME advice;
Translate medical, pharmaceutical and managerial business demands into IT solutions while implementing and maintaining tools and database objects for ETL algorithms, data filtering and aggregation, statistical analysis and prognosis;
Provide project contribution for global cross-functional projects, support audits and inspections directly, manage customer demands and expectations, provide customer relationship management for key customers;
Implement and improve a customer-focused service management strategy including tools and processes, apply basic concepts of service management, software life cycle management, project and validation management;
Develop other people (peer education, training contribution, students development and thesis support);
Deliver the data foundation to PV and Clinical functions, external partners and authorities wherever the product risk/benefit profile must be assessed, and the assessment is derived from PV data, independent from whether a product is OTC or prescription, drug or device;
Put internal customers in the position to deliver rapid responses to regulatory authorities and customers on safety and process topics which maintains Bayer's reputation;
Avoid emerging safety issues by rapidly detecting observations via signal detection and management solutions, contribute to worldwide joined initiatives for improved patient safety and risk/benefit surveillance;
Support product development, indication extensions and restrictions by generating comprehensive risk/benefit analysis on clinical and post marketing data of all kinds including social media, patient support programs and observational non-study healthcare data as available, search for potential benefit reports which might trigger new indications and related cross-selling;
Support product plant production quality using AE data as an indicator for plant production quality and generating observations upon occurrence of quality limitations due to batches leaving the specified parameter range or counterfeit products being sold under the Bayer label;
Increase the efficiency of PV and development processes by generating a high data throughput while keeping costs under control during repetitive analysis of >3 Mio adverse event reports stored in the Bayer PV database and even more records being analyzed on foreign databases such as FDA AERS and WHO VigiBase;
Support company acquisitions during takeover of foreign PV data.

WHO YOU ARE

Your success will be driven by your demonstration of our LIFE values. More specifically related to this position, Bayer seeks an incumbent who possesses the following:

Required Qualifications:

Pharmacovigilance or Clinical experience OR Bachelor of Science, Master of Science, B.S RPH, RN HCP or Life Science degree with at least five years of Pharmacovigilance experience or clinical experience or relevant Bayer Pharmaceuticals AG experience;
Demonstrated ability to analyze and solve complex problems and new demands;
Demonstrated ability to lead project teams in an agile environment and to take responsibility for outcomes;
Experience in working with the Oracle Argus Safety tool suite, Aris G or other Pharmacovigilance tools;
Experience in implementing solutions in Oracle SQL, SAS, R;
Expertise in the principles of software development, quality management, process and service management;
Knowledge of and experience with MedDRA dictionary;
Understanding of the concepts of taxonomies, terminologies and ontologies in the relevant medical science context;
Knowledge of GxP principles and operational aspects of IT systems;
Customer orientation and partnership with internal customers as well as external and internal colleagues in a global team;
Excellent verbal and written English skills;
Ability to analyze and solve problems and to structure complex tasks.

Preferred Qualifications:

Experience working with Argus tool;
Additional experience in SAP HANA DB, Python, Spotfire, Crystal Reports, Business Objects;
Knowledge of and experience with WHO DD, ATC Codes, SNOMED.",3
"Purpose of Job
The USAA Corporate Responsibility (CR) function leads USAA’s enterprise Corporate Social Responsibility (CSR) program and defines philanthropic strategies, targets and goals that improve lives in the military community and USAA’s local communities; and in doing so, reinforces the authenticity of the USAA brand as the nation’s leading military-focused corporate citizen. The Lead Business Support Analyst role is responsible for helping ensure USAA is positioned for and responsive to the growing expectations among internal and external stakeholders for transparent reporting on our corporate responsibility investment and initiatives. In conjunction with both the Senior Vice President, Corporate Responsibility and as well as the Director of Operations, Corporate Responsibility, the role’s portfolio will include continued tracking and measurement of progress across corporate citizenship goals, engagement on social impact goals and metrics with nonprofit alliances, and production of USAA’s formal and informal reporting initiatives (e.g., CR report metrics, website, intranet, ad hoc inquiries, etc.). The role will work collaboratively across the members of the Corporate Responsibility leadership team and internal working groups to track progress in individual areas, signal evolving topic areas and expectations of external interest and perform assessments and develop recommendations for further action to fill performance and/or transparency gaps.


We are currently seeking a talented Business Support Analyst Lead for the San Antonio One Riverwalk Office.

Conducts analysis and evaluation of business data to identify solutions to moderate to complex business problems. Works to ensure operational processes are integrated and effective across the organization. Implements business strategy and goals through the collection, analysis, review, reporting, documentation and communication of business needs and requirements. Manipulates data for research to support the business in identifying problems and solutions.
Job Requirements
Job Requirements
Tasks:
Recommends changes in methods or procedures to increase efficiency, as necessary.
Applies subject-matter-expert functional knowledge to produce complex work deliverables in support of departmental initiatives.
Manages broad functional projects and/or participates as a SME project resource on larger initiatives.
Identifies opportunities and facilitates significant improvements to processes and systems.
Performs complex tasks under minimal supervision and has discretion to deviate from established procedures and guidelines.
Serves as a team lead and may be a proxy for middle-management leadership.
Coaches and provides on-the-job training for other team members.
Minimum Education
Bachelor’s Degree
4 additional years of related experience beyond the minimum required may be substituted in lieu of a degree.
Minimum Experience
8 or more years of related experience and accountability for complex tasks and/or projects required.
Subject-matter-expert knowledge of the function/discipline and demonstrated application of knowledge, skills and abilities towards work products required.
Subject-matter-expert level of business acumen in the areas of the business operations, industry practices and emerging trends required.
*Qualifications may warrant placement in a different job level*
When you apply for this position, you will be required to answer some initial questions. This will take approximately 5 minutes. Once you begin the questions you will not be able to finish them at a later time and you will not able to change your responses.
*Qualifications may warrant placement in a different job level*
When you apply for this position, you will be required to answer some initial questions. This will take approximately 5 minutes. Once you begin the questions you will not be able to finish them at a later time and you will not able to change your responses.
Preferred Experience:
Experience developing and implementing corporate social responsibility impact measures and metrics utilizing visualization techniques to support the relevant points of the analysis.
Expert business/analytical knowledge to lead discussions with cross functional teams to understand and collaborate highly complex business objectives and influence solution strategies.
Identifies and gathers the relevant and quality data sources required to fully answer and address the problem for the recommended strategy through testing or exploratory data analysis (EDA).
Succinctly delivers complex analysis/findings in a manner that conveys understanding, influences senior executives, garners support for recommendations, drives business decisions, and influences business strategy.
3 or more years demonstrates expert skills in in a decision support analytic function approaches used to drive fact-based decision-making.
Organizes and oversees the development of requirements/resources necessary to meet objectives.
The above description reflects the details considered necessary to describe the principal functions of the job and should not be construed as a detailed description of all the work requirements that may be performed in the job.
At USAA our employees enjoy one of the best benefits packages in the business, including a flexible business casual or casual dress environment, comprehensive medical, dental and vision plans, along with wellness and wealth building programs. Additionally, our career path planning and continuing education will assist you with your professional goals.
Relocation assistance is not available for this position.
For Internal Candidates:
Must complete 12 months in current position (from date of hire or date of placement) or must have manager’s approval prior to posting.
Last day for internal candidates to apply to the opening is 4/2/20 by 11:59 pm CST time.",0
"Jr. Data Engineer-Contract Role in Secaucus, NJThis position will assist the Sr. Engineer(s) working within the Microsoft-centric on-premise business intelligence environment and assist with the design of future data warehouses which includes cloud-based platforms. We are looking for a strong hands-on data engineer that comes from a digital marketing background, managing large data sets from prominent digital marketing platforms such as Adobe DTM, Google Analytics, Amplitude, etc. This role requires the candidate to be tech savvy and they will have an aptitude for the specific technologies listed below, proven work experience in constructing and working with business intelligence tools and architectures, and strong communication skills.Major Responsibilities: Daily triage of bugs and tasks.Evaluation, maintenance, and enhancement of existing ETL processes and model/cube structures.Analysis, design, coding, performance tuning, and implementation of new Bl solutions.Code data ingest solutions (C#, NodeJS) leveraging 3rd party APls (Nice to have).Create documentation for applications and processes.Enforce best practices in all aspects of work and evaluate new data warehousing platforms and solutions.Required Skills/Knowledge: 5+ years' experience in a data warehouse team environment.Experience with Microsoft SQL Server, SSAS and SSMS (Management Studio)Hands-on experience with SSIS or other similar ETL toolsDemonstrated strength with T-SQL for database queries, procedures, tables, views, etc.Ability to work with .Net development tool Visual Studio 2017 to write code, make changes, and deploy updates.A basic understanding of HTML, CSS, and web page deployment.Excellent written and verbal skills and the ability to present to upper management.Experience with storage devices and connectivity tools such as AWS development tools: NodeJS and Lambda Functions. (Nice to have)Job Types: Full-time, ContractContract Length:VariesBenefits:None",3
"Applicants for employment in the US must have work authorization that does not now or in the future require sponsorship of a visa for employment authorization in the United States and with Ryan LLC (i.e., H1-B visa, F-1 visa (OPT), TN visa or any other non-immigrant status).


The Business Analyst, Innovation Lab (“Business Analyst”) gathers requirements, assists in work planning, development, and validation testing for Innovation Lab cross-functional enterprise initiatives and/or projects as part of an Agile and Scrum team. They work to ensure that goals or objectives are accomplished within prescribed timeframes and specifications. This position works closely with a Project Manager, Functional area Subject-Matter Experts, and team members at all levels of the Firm in both Service Delivery and Global Shared Services.
Duties and responsibilities, aligned to Ryan’s Key Results:
People:
Serves as a liaison between the Innovation Lab and the business on assigned projects under the direction of a Project Manager.
Acts in role of “Product Owner” ensuring the spirit of the Innovation Lab solution requirements and expected outcomes are represented and ultimately met.
Participates in project planning, story grooming, daily standup, post-mortem, and other project-related meetings.
Demonstrates Ryan’s core values by creating a positive, accountable work environment for a growing, entrepreneurial team.
Client:
Establishes and maintains strong relationships for project execution and delivery.
Escalates and manages project issues and risks to the appropriate stakeholders with clarity, timeliness, and professionalism.
Assists Project Manager in developing and maintaining project plans based on business requirements, timelines, budgets, and required staffing resources.
Assists Project Manager in monitoring the integration of business requirements throughout the project life cycle.
Works closely with applicable departments to ensure successful execution of projects.
Demonstrates ability to document and translate requirements while making connections to business processes and potential risk and technology solutions.
Value:
Works with stakeholders to create, validate, and document project scope specifications, detailed business requirements, and expected outcomes; ensures stakeholders are included in the development, review, and approval process.
Assists stakeholders in the review of proposals, contracts, statements of work, or other relevant documentation related to projects.
Assists Development and QA to ensure the solution meets the expected business result.
Validates the Innovation Lab solution(s) to meet the business requirements and expected outcomes, as well as the standards of the Firm.
Develops and updates documentation relating to business/technical requirements.
Performs other duties as assigned.
Education and Experience:
Required:
Bachelor’s degree in related field or equivalent work experience with at least two to three years of progressive business analysis experience.
Proven record of successfully delivering as a Business Analyst on digital transformation or complex projects involving multiple stakeholders and systems.
Hands-on experience with low-code, Business Process Management (BPM), Alteryx, relational databases, reporting and analysis, and/or Robotic Process Automation (RPA) solutions.
Strong Differentiator:
Experience with Continuous Integration/Continuous Delivery, Agile Scrum, and DevOps methods.
Experience with modern enterprise (GUIs) and integrating these applications leveraging their APIs.
Knowledge of tax, compliance, or accounting processes and applications.
Fluency in at least one programming language, scripting language, or automation platform.
Experience with one or more database platform is also a strong indicator for success in the role.
Excellent communicator with the ability to translate data into actionable insights.
Skilled at using requirements to drive the design or review of test cases, process change requests, and manage a project’s scope, acceptance, installation, and deployment.
Strong communication/interpersonal skills.
Computer Skills:
To perform this job successfully, an individual must have intermediate knowledge of Microsoft Project, Word, Excel, Access, PowerPoint, Outlook, Visio, and Internet navigation and research. Functional knowledge of finance packages, HRIS, and CRM applications (e.g., Workday and Salesforce) are strongly preferred. Fluency in at least one programming language, scripting language, or automation platform is highly desired. Experience with one or more database platform is also a strong indicator for success in the role.
Supervisory Responsibilities:
This position has no supervisory responsibilities.
Work Environment:
Standard indoor working environment.
Occasional long periods of standing.
Position requires regular interaction with employees and vendors both in person and via e-mail and telephone.
Travel requirement approximately 20%.
Equal Opportunity Employer: disability/veteran",0
"Summary:

MINDBODY’s Data Science department makes sense of our data world through meaningful and actionable insights, identifying trends, delivering reports, informing product and infrastructure advancements and promoting a culture of data-driven decision making.

The Data Engineering (DE) branch of MINDBODY’s Data Science department is focused on providing innovative and large-scale data platform solutions in a shared services model to support enterprise data needs of MINDBODY. This involves building data pipelines to pull together information from different source systems; integrating, consolidating and cleansing data and then structuring it for use in reporting and analytical applications. This team also architects distributed systems, data stores and collaborates with data science teams in building the right solutions for them. The data provided by DE team is used in supporting key functions and initiatives within Product Development, Business Development, Customer Experience/Success, Marketing and Sales at MINDBODY.

The Data Engineer III focuses on designing, implementing and supporting new and existing data solutions-data processing and data sets to support various advanced analytical needs of MINDBODY'S Spa-Salon business unit. You will be designing, building and supporting data pipelines consuming data from multiple different source systems and transforming it into valuable and insightful information. You will have the opportunity to contribute to end-to-end platform design for our cloud architecture and work multi-functionally with operations, data science, architecture and the business segments to integrate the spa-salon's database into the batch and real-time data solutions. The role will be part of a team supporting our Corporate, Sales, Marketing and Consumer business lines. The role will be part of a team supporting our Spa-Salon business unit.

Duties and Responsibilities:

Design, implement and support a platform providing access to large datasets.
Create unified enterprise data models for analytics and reporting.
Design and build robust and scalable data integration (ETL) pipelines using SQL, Python and Spark.
As part of Agile development team contribute to architecture, tools and development process improvements.
Work in close collaboration with product management, peer system and software engineering teams to clarify requirements and translate them into robust, scalable, operable solutions that work well within the overall data architecture.
Coordinate data models, data dictionaries and other database documentation across multiple applications.
Leads design reviews of data deliverables such as models, data flows and data quality assessments.
Promotes data modeling standardization, defines and drives adoption of the standards.
Work with Data Management to establish governance processes around metadata to ensure an integrated definition of data for enterprise information and to ensure the accuracy, validity and reusability of metadata.

Work Environment and Physical Demands:

Dexterity of hands and fingers to operate a computer keyboard.
This position is mostly stationary and will be required to remain stationary for extended periods of time.
Specific vision abilities required by this position include close vision, color vision and the ability to adjust focus.
The noise level in the work environment is usually moderately quiet.

Scope of Supervision:

Duties are performed under moderate supervision. Will receive training and guidance when working on new processes and procedures. Most decisions will be routine and do not require supervisor assistance. No direct management responsibility.

The incumbent or successful candidate must meet the job requirements above in order to perform the essential functions of this position and achieve the outcomes/results indicated in this job description. The Company will make every effort to make reasonable accommodations upon request to enable qualified individuals with known disabilities to perform the essential functions of their job.
Minimum Qualifications and Requirements:

7+ years of relevant experience in one of the following areas: Data engineering, business intelligence or business analytics.
5-7 years of supporting a large data platform and data pipelining.
5-7 years of experience with SQL-Server, SSRS, SSIS, and T-SQL.
2+ years of experience with Azure and AWS services including AzureSQL, S3, Redshift, EMR and RDS.
2+ years of experience with Big Data Technologies (Snowflake, DataLakes, Data Warehouses).
Support a Secure Data Extract (SDE) system for strategic accounts; ensure jobs are run efficiently and reliably providing data to clients.
Address data pull requests for various consumers and/or oversee other data engineers fulfilling them.
Address data integrity issues providing fixes and uncovering the origination and providing solutions to prevent the condition in the future and/or oversee other data engineers fulfilling them.",3
"Description:

About Us
AE Strategies is a Mclean, VA based consulting firm, founded in 2003, providing management consulting to federal clients. We are a proven small business with an established reputation and a track record of supporting critical initiatives across a wide range of federal clients. Employees will work on challenging and impactful federal initiatives in a positive and collaborative work environment with competitive compensation and benefits and a collaborative and supportive company culture that is designed to support client success and employee development. Find out more at www.aestrategies.com.
Overview
The Data Scientist will join an AE Strategies team supporting the Department of Defense, Inspector General’s Office to apply mathematical modeling and advanced techniques to integrate, process, analyze, and visualize data. This support will help our client to analyze and direct incoming complaints to the right follow-on team (criminal investigators, inspectors, and auditors). The support will include applying natural language processing (NLP) techniques to incoming hotline complaints that enable a more automated, data-driven triage system across the lifecycle of every individual complaint, from submission to resolution. The support provided will improve the quality of data and analysis surfaced in our client’s supply chain security. Specific responsibilities include:
Provide data analysis, and visualization support, graph and social network analysis
Assist project teams with identifying, gathering, and understanding relevant data to support analysis, as well as, assess relative quality and reliability of the data
Assist with data preparation, including data cleansing, transformation, combination, aggregation, and scripts for recurring ingestion and general data automation in preparation for modeling and analysis
Assist with developing data visualizations of results for ease of use and adoption of analytics
Examine large data sets to identify trends, develop charts, and create visual presentations to help the organization make more strategic decisions
. Requirements:
Bachelor’s Degree required
3 years of relevant professional experience
Active Secret Clearance
Direct experience creating sustainable, automated processes for data analysis
Technical expertise with programmatically manipulating data
Proficiency in R programming
Cloudera Hadoop familiarity
Natural Language Processing (NLP) experience is a plus
Spark programming experience is a plus",1
