description,y
"Position Demographics
At the Regional Transportation District of Denver, CO (RTD) our mission is to meet our constituents' present and future public transit needs by offering safe, clean, reliable, courteous, accessible and cost-effective service throughout the District. We look for candidates to join our team in creating a legacy for current and future generations.
-
RTD is an equal employment opportunity employer. RTD is a Drug-Free Workplace.

The Immigration Reform and Control Act requires that verification of employment eligibility be documented for all new employees by the end of the third day of work.

The Regional Transportation District complies with the Americans with Disabilities Act (ADA), to provide reasonable accommodations for persons with disabilities.

RTD participates in E-Verify and will provide the federal government with your Form I-9 information to confirm that you are authorized to work in the U.S. If E-Verify cannot confirm that you are authorized to work, this employer is required to give you written instructions and an opportunity to contact Department of Homeland Security (DHS) or Social Security Administration (SSA) so you can begin to resolve the issue before the employer can take any action against you, including terminating your employment. Employers can only use E-Verify once you have accepted a job offer and completed the Form I-9.

Description of Work
This position manages and supports activities related to developing, implementing and ensuring that reporting and document retention is in compliance with Federal Railroad Administrative Regulations, other regulatory requirements and internal Standard Operating Procedures.
Duties & Responsibilities
ESSENTIAL:

Develops and implements policies, business processes, strategies and procedures for document retention, and control to ensure compliance with organizational policies, relevant legislation, legal guidelines, Colorado Public Utilities Commission and Federal Railroad Administration Regulations and Reporting requirements.

Acts as the primary data analyst and ensures single document repository control for Configuration Management, Software Configuration Management, Safety and Security, Positive Train Control and Inspection Management as required for a FRA Regulated Railroad.

Serves as energy account manager and assists Senior Accountant to monitor, track, and audit traction power, signal, communication house energy usage, building power usage and billing and assists in forecasting departmental budget needs. Reports annually to the U.S. Department of Transportation National Transit Database (NTD).

Assists Safety and Security with NTD reporting for the Commuter Rail Network.

Analyzes information and evaluates results using logic and reasoning to identify the strengths and weaknesses of alternative solutions.

Assists in developing, planning and implementing FRA reporting structures, data reporting and retention as required, software and technical reporting improvements, training and resourcing staff concerning reporting management and organization. Ensures hours of service and other FRA retention reports are secured in the central repository.

Acts as liaison to Information Governance for internal document requests, CORA requests and provides support for Customer Care requests.

OTHER:

All job-related duties as assigned.
Qualifications
Bachelor's degree in Business Administration, Decision Science, Mathematics, Analytics, Engineering or a closely related field.

A minimum of four years of experience in records management or a document management environment.

A minimum of four years of experience with software such as Oracle, Aconex, RailDocs, Laserfiche or other reporting software,

A minimum of three years of experience in statistical analysis or data analysis with the ability to compile, code, categorize, calculate, tabulate, audit, and verify information and/or data and a minimum of two years of experience reporting and document retention in an FRA regulated railroad.

Knowledge of FTA/FRA/ADA/CPUC statutes, regulations, and laws associated with reporting and record management in an FRA regulated railroad preferred.

Ability to recognize information of a sensitive nature, and other issues requiring consultation with legal or escalation to subject matter experts.

Ability to work in a team environment and interpret the meaning of information for others by translating or explaining what the information means and how it is to be used.

Proficient with Microsoft Office Suite.

Ability to communicate effectively, orally and in writing.

Ability to use sound judgment.

Ability to manage time and workload effectively which includes planning, organizing, and prioritizing with attention to details.

OR:

An equivalent combination of education, experience, knowledge, skills, abilities.",0
"We are looking for a Senior Data Scientist to join our new Data Center and Networking AI Team to solve some of the hardest and most interesting technological challenges facing the industry today.
The Team
You will be joining a new team of world-class high-performing and low ego engineers and scientists that have an entrepreneurial and hacker spirit. The team will operate in a very self-driven, agile and fast-paced environment.
The team operates by self-organizing, around shared values, vision and objectives.
Keys to Hiring
You are the best candidate for this position if you are both mathematically inclined, self-motivated. You generate new ideas and initiatives to solve problems and identify trends and opportunities. You are comfortable working independently and figuring things out, and also enjoy working collaboratively in a small, fast-paced entrepreneurial environment. You enjoy being challenged and respectfully challenging others.
You write code almost every day and are comfortable working with your team to produce tools, pipelines, packages, modules, features, dashboards, or whatever is needed to move the team forward. You have a hacker’s spirit. You’re a quick study and technically flexible.
You have a strong ability to communicate about algorithms, complex data science methods, and statistical results to normal people in simple English using common ground, metaphors, and storytelling. You are intellectually curious, and enjoy looking at large data sets, to discover insights, and piece together stories. You like to develop a strong intuition to data by cleaning, organizing and labeling it. Other duties and responsibilities include, but are not limited to the following:
Build data pipeline to support data science needs
Build, test and deploy custom ML/AI models and algorithms on large datasets, and develop processes for monitoring and analyzing their performance on live mission critical environments
Drive innovation roadmaps to improve our machine learning models and experimentation techniques
Stay abreast with latest academic research to find best solutions for our use cases
Write or contribute to technical articles and white papers to showcase your work with visualizations to demonstrate ideas, challenges, algorithms, and results
Collaborate with academia and engineering/data science teams across companies and business units

Qualifications:
Ph.D. in Statistics, Computer Science, Machine Learning, Mathematics, Computational Psychology, Operational Research, Physics or relevant field
5+ years of most recent experience building models hands-on and track record of solving complex enterprise problems from scratch that went to production
Fluency in a programming language (Python, R, C, C++, Java)
Experience working with AI/ML technologies like TensorFlow, PyTorch, Keras, Caffe, scikit-learn, Spark MLlib and large-scale data sets and generating unique models and algorithms
Proficiency with analytical and database tools (e.g. Jupyter notebooks, Hive, Presto, SQL, No-SQL)
Strong background in classical machine learning and deep knowledge in a variety of techniques in feature selection, regression, classification, and clustering, and their real-world advantages and drawbacks
Domain knowledge of and hands-on experience building AI solutions for data centers, enterprise networks, WAN networks is a bonus",1
"WHAT WE'RE ABOUT

We're creating an airline people love. It begins with each Alaska Airlines employee, bringing unique strengths and energy to our work in the air and on the ground. Every day, we go beyond what's expected and reach for the remarkable, together.

YOUR ROLE

Role Summary

Become part of a dynamic environment that offers a hands-on internship experience. We are looking for talented and enthusiastic students to contribute toward key projects that support our business, community and cultural growth. Experience a work environment that thrives on innovation, collaboration and partnership.

Scope & Complexity

We want to talk to undergraduate students in their junior year who have accomplished outstanding academic results. The program is designed for a commitment of 40 hours per week for the duration of the 12-week program. When not working, we invite our interns to take advantage of unlimited complimentary space-available travel on Alaska Airlines or Horizon Air... Lunch in San Diego? Weekend in Portland? Maui? Phoenix... Done!

Key Duties

Build Azure Cloud based Azure Functions that read from Azure Service Bus and write data to a MongoDB based ODS and to an Azure Data Lake.

Build Python based integration tests.

Utilize established patterns and frameworks to develop deliverables.

Design JSON data structures suitable for key components in our enterprise ODS and data lake.

Work with a team of developers to define and produce deliverables.

Job-Specific Skills & Education

Required

Demonstrated ability to quickly learn a large number of new tools quickly.

Experience working with some or all of these: Azure Cloud Portal, Azure Functions, Azure Service Bus, JSON, MongoDB or MongoDB Atlas.

Experience coding with Python.

Experience working with Git source code control.

Internship positions are open to current undergraduate students in their junior year who are enrolled in a full time course of study graduating between December '20 and June '21.

High school diploma or equivalent is required.

Minimum age of 18.

Must be authorized to work in the U.S.

Preferred

Experience coding Azure Functions in Python using Visual Studio Code.

Experience setting up patterns and frameworks to enable building deliverables in a repeatable manner.

Demonstrated passion for producing top quality deliverables.

Job-Specific Leadership Expectations

Embody our values to own safety, do the right thing, be kind-hearted, deliver performance, and be remarkable.

START YOUR NEW JOURNEY NOW

Submit your application by 02/18/2020 11:59pm (Pacific Time). We'll be happy to see it.

EQUAL EMPLOYMENT OPPORTUNITY

Horizon Air and Alaska Airlines are equal opportunity employers. All qualified applicants will receive consideration for employment without regard to race, color, religion, sex, sexual orientation, gender identity, gender expression, national origin, age, protected veteran or disabled status, or genetic information.

Horizon Air and Alaska Airlines will consider for employment qualified applicants with arrest and conviction records in accordance with applicable Federal, State, and local laws.

Horizon Air and Alaska Airlines participate in E-Verify, a service of the Department of Homeland Security (DHS) and Social Security Administration (SSA), where required.

Job ID 36195

Location Seattle, WA

FLSA Status Nonexempt",3
"Ultimate Software understands the value of data. The Data Engineering team is seeking a Cloud Data Engineer to help us extract this value. The team is responsible for all stages of data lifecycle management which includes capture, maintenance and publication. You will be responsible for designing, developing, testing, deploying and supporting data management solutions. This includes BI development, data pipeline (ETL/ELT) development, API data integrations, data quality and process monitoring/alerting.

Here at Ultimate Software, we truly put our people first. We strongly believe in teamwork, and we encourage and trust our people to reach higher, learn more, and live up to their potential. Ultimate is ranked #1 on Fortune's Best Places to Work in Technology for 2020 and #2 on the 100 Best Companies to Work For list in 2020. Ultimate is also ranked #2 on Fortune’s 75 Best Workplaces for Women and #9 on its Best Workplaces for Diversity list. Learn more about US here: www.ultimatesoftware.com/careers

Primary/Essential Duties and Key Responsibilities:

Design, develop and support database entities, data pipelines and processes required
for data integration (ETL/ELT)
Implement processes that ensure data quality, code quality, and the confidentiality of
all data
Possess the ability to learn emerging technologies quickly and apply them effectively
Design, implement, lead and manage large-scale, enterprise-wide and complex data
projects
Define and comply with internal development coding standards, procedural guides,
and checklists for the support of the data platform.
Provide in-depth troubleshooting skills to assist in resolving errors and performance
issues, including tier 2 production support
Understand business requirements, contribute to technical requirements and deliver
on time within a SCRUM methodology.


Required Qualifications:

6+ years with relational databases and SQL
3+ years data warehouse and ELT/ETL experience
2+ years programming with Python (Pandas and other common libraries)
2+ years object oriented programming experience
2+ years API integration experience
1+ year experience performing data integrations or data warehousing in a cloud data
platform, preferably Google Cloud


Preferred Qualifications:

Experience with data warehousing using Big Query in Google Cloud.
Experience with GCP Services - Cloud Dataflow, Cloud Firestore, Cloud Composer and Stackdriver.
A broad range of knowledge across Big Data, Azure, Data Vault, Tableau and other emerging technologies.

Education/Certification/License:

Bachelor’s Degree in Information Systems or related discipline preferred.


Travel Requirements:

Limited upon request


This job description has been written to provide an accurate reflection of the current job and to include the general nature of work performed. It is not designed to contain a comprehensive detailed inventory of all duties, responsibilities, and qualifications required of the employees assigned to the job. Management reserves the right to revise the job or require that other or different tasks be performed when circumstances change.

Ultimate Software will reasonably accommodate employees with disabilities as defined by the Rehabilitation Act of 1973, the Americans with Disabilities Act (ADA) and other appropriate statutes. If you are an applicant and need a reasonable accommodation when applying for job opportunities within the Company or request a reasonable accommodation to utilize the Company’s online employment application, please contact accessibility@ultimatesoftware.com.",3
"Named as one of Fortunes’ 100 Fastest Growing Companies for 2019, EPAM is committed to providing our global team of 30,100+ EPAMers with inspiring careers from day one. EPAMers lead with passion and honesty and think creatively. Our people are the source of our success and we value collaboration, try to always understand our customers’ business, and strive for the highest standards of excellence. No matter where you are located, you’ll join a dedicated, diverse community that will help you discover your fullest potential.


Description

You are curious, persistent, logical and clever – a true techie at heart. You enjoy living by the code of your craft and developing elegant solutions for complex problems. If this sounds like you, this could be the perfect opportunity to join EPAM as a Senior Big Dara Engineer. Scroll down to learn more about the position’s responsibilities and requirements.


EPAM Big Data Practice is looking for the Cloudera Big Data Engineers. As the Cloudera Data Engineer, you will be responsible for design and implement the management, monitoring, security and privacy of data using the full stack of Cloudera Hadoop Ecosystem services to satisfy the business needs.

#LI-DNI
#LI-DNP
What You’ll Do
Implement non-relational data stores:
Implement a solution that uses Hive, HBase, Impala DB, HDFS
Implement data distribution and partitions
Implement a consistency model in Hive/HBase
Provision a non-relational data store in HDFS
Provide access to data to meet security requirements
Implement for high availability, disaster recovery, and global distribution
Manage data security:
Implement data masking
Encrypt data at rest and in motion
Develop batch processing solutions:
Develop batch processing solutions by using Hive and Spark transformations
Ingest data by using Sqoop
Create linked services and datasets
Create oozie workflow pipelines and activities
Create and schedule jobs
Implement Cloudera Spark clusters, jupyter notebooks, jobs, and autoscaling
Ingest data into Cloudera HDFS
Develop streaming solutions:
Configure input and output with Kafka
Select the appropriate windowing functions
Implement event processing by using Spark Streaming /Kafka
Ingest and query streaming data using Spark
Monitor Cloudera Services:
Monitor Cloudera Cluster and its services like Spark, Oozie workflows, HDFS, Hive etc
Optimize Cloudera data solutions:
Troubleshoot data partitioning bottlenecks
Optimize HDFS Storage
Optimize Spark Streaming Analytics
Optimize Hive/Impala Analytics
Manage the data lifecycle
What You Have
5-10+ years in IT
2-3+ years in Cloudera and Hadoop Ecosystem
Experience in Agile or PMI methodology managed projects
Experience in enterprise applications, solutions and data infrastructures
Experience in designing of data management solutions
Experience in designing of robust CI/CD solutions
Python/PySpark (highly desired)
Java/Scala
Apache Hadoop HDFS, Map Reduce
Oozie
Hive
Cloudera Impala
Spark
Kafka
Spark Streaming
Yarn
Sqoop
Git, GitLab, Artifactory
ADO
Certifications:
SCRUM Developer
Big Data Hadoop certification
What We Offer
Medical, Dental and Vision Insurance (Subsidized)
Health Savings Account
Flexible Spending Accounts (Healthcare, Dependent Care, Commuter)
Short-Term and Long-Term Disability (Company Provided)
Life and AD&D Insurance (Company Provided)
Employee Assistance Program
Unlimited access to LinkedIn learning solutions
Matched 401(k) Retirement Savings Plan
Paid Time Off
Legal Plan and Identity Theft Protection
Accident Insurance
Employee Discounts
Pet Insurance",3
"NO THIRD PARTY RESUMESJob Title: Data Analyst/Report Writer ILocation: Glendale Milwaukee WI 00001Duration: 6 Months Contact W2Description:Job Description: Transformation Data AnalyticsWhat you will doTransformation Data Analytics will be part of the Transformation Office reporting to the Transformation Office Director and Program Manager. You will apply your data engineering skills to solve real-life, complex problems and deliver long term sustainable impact. You will work with Transformation Program Management Team to set-up and execute a best in class Transformation Office and the related Performance Infrastructure. You'll build business, optimization, and financial models and deploy Transformation tools drawing upon various analytics techniques e.g., Excel, VBA, Tableau, SQL, Alteryx, Power BI, M, DAX etc. You will also enable best in class deployment of Transformation management tools and enable effective cadence planning, impact capturing, and program management. You will be responsible for database hygiene – providing quality control checks and proactively fixing issues; act as the primary point of contact for custom data requests, oversee any changes to the back end of the databases; and be responsible for regular database updates.How you will do itYou will work hand in hand with Transformation Office leadership, Workstream members, and Wave champions to ensure seamless delivery of dashboards and reports. Provide guidance and leadership to teams on analytics, build Workstream capabilities. Produce, maintain, and distribute the Transformation Office reports for all Workstreams. Conduct ad hoc analyses as requested, proactively searching for opportunities to deliver additional insights to members of the Transformation Office and Executive Committee. Be the first point of contact for Transformation participants with data questions. Have a complete understanding of the data and its structure, and provide coaching as necessary.Provide data and analytical support for the creation of financial and operational analyses supporting transformation and ongoing strategic plans and other documents.Required QualificationsUndergraduate or Graduate degree, preferably in Computer Applications, Engineering, Business Management, Mathematics, Operations researchStrong data modeling and data visualization skills across a range of platforms including 1) Excel and Excel VBA, 2) PostgreSQL or similar data engineering platforms, and 3) PowerBI (including DAX and M languages with at least 3 years of experienceExcellent analytical and problem-solving skills, including the ability to disaggregate issues, identify root causes and recommend solutionsKnowledge of fundamental business concepts, operations research and statistical techniquesDetail oriented and with ability to work under pressure, mentally resilient to endure the long and tough road of a transformationFlexibility, patience, and an understanding of fluid, demanding, and unstructured environments where priorities evolve constantlyHighly pragmatic, focused on achieving outcomes and impactEntrepreneurial and proactively thinking about potential improvements to how things are donePrevious work experience in building business algorithms, scenario planners, solving business problems using optimization techniques and running project management offices is preferredPassion for/attention to detailAbility to work effectively in a high pace environmentBasic software engineering project management experience in Agile, Lean, or Scrum development is a plus (in particular defining requirements, rapidly iterating and deploying features)Desires to accelerate their career path through a challenging and rewarding experiencePlease fill the details for Submission:Legal name:Contact no:Email id:Visa status:Current location:Relocation:Availability:End date of recent project:Linked in:Pay Rate Expected:Thanks&RegardsVenkat KothaTrigent Software Inc2 Willow Street, Suite #201 Southborough, MA 01745508-779-6728venkat_k @ trigent.comJob Type: ContractSalary: $29.00 to $35.00 /hourExperience:business analysis: 1 year (Preferred)data analyst: 1 year (Preferred)analytics: 1 year (Preferred)sql: 1 year (Preferred)data analysis: 1 year (Preferred)Benefits:None",0
