description,y
"About the Department of Pathology:
Comprised of extraordinary faculty and staff, our mission is to improve the diagnosis, treatment and basic understanding of human disease. We accomplish this through our clinical services, research, and training the future leaders in pathology and related fields. A major focus of clinical research in the Department continues to be the correlation of patient outcome and treatment response with the surgical pathologic diagnosis of human cancers. Everything we do is to provide the highest quality of pathology diagnostic services to the patients for whom we passionately care.

For more information about the department visit http://pathology.stanford.edu/


About the Position:
We are seeking a Research Data Analyst 1 to join the group of Dr. Mike Angelo at the Stanford Blood Center in the Department of Pathology. This Data Analyst will aid in the development of algorithms and software for analysis of highly-multiplexed imaging data generated by a next-generation IHC platform (Multiplexed ion beam imaging) housed in the Angelo lab. A strong background in analyzing biological imaging data is desired. The Data Analyst will play a key role in designing, building and maintaining the analytical pipelines used for routine image analysis in the lab. Additionally, the Data Analyst will develop new methods for image segmentation, object identification and phenotyping. In addition to these cross-project responsibilities, the Data Analyst will also be involved in individual project, assisting M.D.s and Biology Ph.D.s in their data analysis tasks. Must be a good team player.
Duties include:
Collect, manage and clean datasets.
Employ new and existing tools to interpret, analyze, and visualize multivariate relationships in data.
Create databases and reports, develop algorithms and statistical models, and perform statistical analyses appropriate to data and reporting requirements.
Use system reports and analyses to identify potentially problematic data, make corrections, and determine root cause for data problems from input errors or inadequate field edits, and suggest possible solutions.
Develop reports, charts, graphs and tables for use by investigators and for publication and presentation.
Analyze data processes in documentation.
Collaborate with faculty and research staff on data collection and analysis methods.
Provide documentation based on audit and reporting criteria to investigators and research staff.
Communicate with government officials, grant agencies and industry representatives.

Desired Qualifications:
Bachelor’s degree in Mathematics, Statistics, Computer Science or related field.
Research experience in computational biology desired; specifically in analysis of high-throughput, multiplexed data. Experience in designing data analysis pipelines is an advantage.
Experience in industry as software engineer is desired; specifically is generating graphical user interfaces.
Knowledge and experience in machine learning is highly desired; specifically application of deep learning to computer vision and image analysis.
Intimate knowledge with at least one of the following programming languages: Python/R/Perl/Matlab/Java/C/C++
The candidate should be able to work independently, be highly motivated, well organized, adaptable and work well within a highly interdisciplinary and international team. Good communication and interpersonal skills as well as fluent English are essential, as well as proficient computer skills (Mac and PC).
Education & Experience:
Bachelor's degree or a combination of education and relevant experience. Experience in a quantitative discipline such as economics, finance, statistics or engineering.

Knowledge, Skills and Abilities:
Substantial experience with MS Office and analytical programs.
Strong writing and analytical skills.
Ability to prioritize workload.

Certification & Licenses:
None
Physical Requirements:
Sitting in place at computer for long periods of time with extensive keyboarding/dexterity.
Occasionally use a telephone.
Rarely writing by hand.

Working Conditions:
Some work may be performed in a laboratory or field setting.",0
"Junior Data Analyst
A content technology platform, Nativo helps advertisers create meaningful brand connections with consumers and empowers publishers with breakthrough monetization solutions. We're preparing the world for the age of content, where digital advertising is becoming a seamless, authentic, and helpful consumer experience.
We invite you to join us for an exciting and rewarding experience as a Junior Data Analyst. This role will assist the Campaign Operations team by providing analytic support through measuring the effectiveness of active and completed native advertising campaigns. This individual will collaborate with other internal departments to advance the capabilities provided by the Analytics team.
What you'll do:
Perform data cleansing/de-duplication/merging/calculation/analysis
Prepare spreadsheets and PowerPoint presentations for clients
Proactively identify potential gaps in data and take the initiative to resolve issues
Provide assistance in other areas of the department/company as needed
What you need:
1-year minimum work experience in campaign analytics
Proficient with Excel (Vlookups, pivot tables, chart visualizations, etc.)
Basic understanding of concepts in online campaign analytics or brand study measurement
Comfortable working with PowerPoint
Exceptional written and verbal communication skills and the ability to present analysis to various levels of management and staff.
Intellectual curiosity to enjoy problem-solving and ask the right questions to arrive at an insight
Excellent teamwork skills
Ability to work well without constant direction
Must enjoy working in a fast-paced entrepreneurial startup environment
BA/BS degree in Business, Marketing, or related field
What We Offer:
At Nativo, you make an immediate impact. Nativo is made up of smart, talented and driven people looking for other potential team members with the same attitude of innovation and excellence. We offer incredible opportunities to learn and work on projects that transform digital advertising. We offer a competitive compensation and benefits package that includes stock options, health coverage, employer-matched 401k, cutting edge work, and the opportunity to join a rapidly growing startup with a proven product.
About Nativo
Nativo empowers brands and publishers with the world's most advanced platform for content.
For brands, Nativo enables storytelling at scale with the largest native reach and reveals insights that unlock return-on-content. For publishers, Nativo enriches monetization with the most comprehensive platform for next-generation ad formats and breakthrough technology for accelerated webpages. Nativo's mission is to equip advertising for the age of content, improving the web experience and creating meaningful connections for today's digital consumer.
From the hands and minds of an amazing team, Nativo has engineered a platform that has been recognized as the best available in the market. Nativo is respected, well-funded, and is recognized as one of the top tech companies to work for. Nativo is well-positioned to play a vital role in forging the path of media and advertising in the coming years. The opportunity to join a team that is making a huge impact is now.
For information on what personal information Nativo collects and how we use it, please see our CCPA privacy notice: https://nativo1.box.com/s/a0j9eonmrveq3ot6mgldvy3jm4f0msu4

Emy7kIdKKf",0
"Req. ID: 180202
Micron Technology’s vision is to transform how the world uses information to enrich life and our commitment to people, innovation, tenacity, collaboration, and customer focus allows us to fulfill our mission to be a global leader in memory and storage solutions. This means conducting business with integrity, accountability, and professionalism while supporting our global community.
We are seeking motivated individual to join our machine learning and deep learning team. Your role is to maintain and use state-of-the-art deep learning algorithms and tools. The team products are high-performance computer vision algorithms, demonstrations, hardware, compilers.
Responsibilities include, but not limited to:
Build and maintain:
Deep learning frameworks, software and models to train neural networks models
Learning scripts and custom learning criterion, optimization modules
Dataset of images and videos
Dataset scripts
Web-optimized scripts for server-side processing
Validation scripts, measure dataset and model performance, and run them on Linux computer clusters
Build code for applied computer vision: saliency, tracking, detection, recognition, localization
Read literature, summarize results, and present results and innovations to the team
Reproduce and validate state-of-art models from papers and publications
Interact with customers, accept and review software and product requirements, satisfy requirements.
Minimum Qualifications:
MS/PhD in Computer Science, Computer Engineering, Electrical Engineering, Physics or related experience
Minimum 5+ years experience on computer vision, machine-learning and deep learning algorithms, including Deep, Convolutional, Recurrent Neural Networks
Experience writing and maintaining professional software using: C, C++, Python, PyTorch, TensorFlow, Caffe or similar deep learning framework
Leader in machine learning competitions, and international datasets
Deep knowledge of machine / deep learning literature, especially recent years after 2012
Open source contributions
State-of-art knowledge of at least one of these computer vision techniques: face-identification, tracking, localization, detection, recognition, saliency, video-processing, image embeddings, similar images, video summarization, language models for image and video description, openCV, etc.
Excellent presentation, written and verbal skills, proven by international level conference participation, acclaimed web blogging
Preferred Qualifications:
Award winner during PhD
Multiple international journal articles or conference presentations
Highly ambitious with forward-thinking and entrepreneurial aspirations
Background knowledge on parallel/heterogeneous programming (CUDA / OpenCL)
Background in Linux administration
Able to set up servers and clouds of servers
Experience in at least one area: text translation, speech recognition, text analysis, sentiment analysis
Experience with recurrent network or similar: RNN, LSTM, neural attention and associative memories
Experience in multimedia Linux software, libav, image and video compression / decompression, formats, processing with ffmpeg, libav and similar
Experience in embedded ARM setup, configuration and use: Raspberry Pi or similar
Graphic design, web design, CAD design
Artistic insights and abilities
About Us
As the leader in innovative memory solutions, Micron is helping the world make sense of data by delivering technology that is transforming how the world uses information. Through our global brands — Micron, Crucial and Ballistix — we offer the industry’s broadest portfolio. We are the only company manufacturing today’s major memory and storage technologies: DRAM, NAND, NOR and 3D XPoint™ memory. Our solutions are purpose built to leverage the value of data to unlock financial insights, accelerate scientific breakthroughs and enhance communication around the world.
Micron Benefits
Employee Rewards Program, Healthcare, Paid time off (Combined Sick and Vacation Time), Retirement savings plans, Paid maternity/paternity leave, Employee Assistance Program, Professional development training, Workplace wellness programs, Micron Health Clinic (Boise only), Fitness Center/Activity rooms (Boise/San Jose only), Tuition Reimbursement, Micron Corporate Discounts, Casual Dress attire.
All qualified applicants will receive consideration for employment without regard to race, color, religion, sex, sexual orientation, gender identity, national origin, veteran or disability status.
For US Sites Only: To request assistance with the application process and/or for reasonable accommodations, please contact Micron’s Human Resources Department at 1-800-336-8918 or 208-368-4748 and/or by completing our General Contact Form
Keywords: Seattle || Washington (US-WA) || United States (US) || DEG (DRAM Engineering Group) || Experienced || Regular || Engineering || #LI-BG1 || Tier 4 ||",2
"Data Analyst - Equinox Media
Overview

OUR STORY:
We are a company with integrated luxury and lifestyle offerings centered on Movement, Nutrition and Regeneration. In addition to Equinox, our other brands, Blink, Pure Yoga, SoulCycle, Furthermore, Precision Run and Equinox Hotels are all recognized for inspiring and motivating members and employees to maximize life. Within our portfolio of brands, we have more than 200 locations within every major city across the United States in addition to London, Toronto, & Vancouver.
Job Description

It is an exciting yet critical time for our teams at Equinox Media and we're looking for a Data Analyst to join our Data team to help us invent new ways of connecting people to the communities and fitness that they love. If you're someone who is passionate about developing strategies based on insights from real people and data, and can turn those insights into opportunities for the business and product teams to grow, then this is the team for you. There will also be significant exposure to modern data processing and analytic tools as your work spans across the broader technology groups as well. Our team embraces a true entrepreneurial spirit; operating with a sense of pride, perseverance and care for one another. We strive to continually deliver the best results and focus on how every action taken helps push our mission forward.
What you'll do:
Providing data reporting functions to the business and technical community using SQL
querying
Working with business and technology partners to build insightful analytical solutions
Troubleshooting data discrepancies along with resolving and clarifying them
Identifying areas where operational efficiency can be improved through enhanced
automation along with implementing those enhancements
Help engineering team with profiling and onboarding new datasets.
Develop automated data profiling and quality checks
Qualifications

Bachelor’s Degree Required. MIS / Computer Science / Engineering / Data Science
discipline
Expertise in SQL Server/ Redshift; SQL analytic capabilities (with 4+
Years hands on experience in SQL)
4+ Years working as a Data Analyst with a strong ability to analyze data and perform
root cause analysis
Ability to extract information from multiple databases using complex query statements
and advanced database tools
Organize, analyze and disseminate medium to large amount of information with great
attention to detail and accuracy
Knowledge of analytic tools like Tableau
Good exposure to Data Warehouse principles and basic understanding of data modeling
concepts and methodologies
Experience working with structured and semi-structured data (xml, json)
Experience working with ticketing and project management systems (Zendesk, Jira)
Strong documentation and communication skills
Creative, flexible, eager to learn, and able to work successfully in a multi-project,
deadline driven environment within Agile framework
Excellent written and verbal communication skills required
Any marketing tools (Adobe, Braze, CDP, ExactTarget) experience a plus
Additional Information

Equinox Media is an equal opportunity employer. We celebrate unique points of views & experiences across age, gender identity, race, sexual orientation, physical or mental ability & ethnicity in building the future of our digital business. We aren’t just a company; we’re a community vested in each other’s success. We value humility and a team approach at every level of the company. We want to inspire a workplace where individuals embrace their differences and similarities, where we are building products and experiences that inspire and improve people's lives.
See what we're up to: https://www.fastcompany.com/90386259/soulcycle-at-home-equinox-announces-streaming-fitness-platform-equipment",0
"Requisition ID: 103442
Job Level: Mid Level
Department: Business Management
Market: Corporate Home Office
Employment Type: Full Time

District Overview
Kiewit Data Services’ (KDS) mission is to make Kiewit the premier data-driven organization in our industry. To accomplish this, our projects and districts need to have the right data, of the right quality, with the right level of analysis, available to them at the right time. KDS is a cross functional organization with employees that have expertise in data, technology, support and operations backgrounds. Our core functions are data Quality, Governance, Enablement, Analytics and Data Science.

Location
This position will be based out of Omaha, NE.

Responsibilities
Perform financial forecasting, reporting, and operational metrics trackingAnalyze financial data and create financial models for decision supportReport on financial performance and prepare for regular leadership reviewsAnalyze past results, perform variance analysis, identify trends, and make recommendations for improvementsWork closely with the accounting team to ensure accurate financial reportingEvaluate financial performance by comparing and analyzing actual results with plans and forecastsGuide cost analysis process by establishing and enforcing policies and proceduresProvide analysis of trends and forecasts and recommend actions for optimizationRecommend actions by analyzing and interpreting data and making comparative analyses; study proposed changes in methods and materialsIdentify and drive process improvements, including the creation of standard and ad-hoc reports, tools, and Excel dashboardsIncrease productivity by developing automated reporting/forecasting toolsPerform market research, data mining, business intelligence, and valuation compsMaintain a strong financial analysis foundation creating forecasts and modelsProficiency with Microsoft Excel is mentioned in virtually any financial analyst job description; familiarity with data query/data management tools is extremely helpful (Access, SQL, Business Objects)

Qualifications
0-3+ years of business finance or other relevant experienceHigh proficiency in financial modeling techniquesStrong fluency with Excel formulas and functionsBA, BS, or B.Com degree required (Bachelor’s Degree in Accounting/Finance/Economics)Strong analytical and data gathering skillsGood business acumenMBAs are preferredProven work experience in a quantitatively-heavy roleFMVA or similar designations preferredStrong quantitative and analytical competencySelf-starter with excellent interpersonal communication and problem-solving skillsAdvanced knowledge of ExcelAbility to streamline functions and passion to learn and growStrong interpersonal skills, including written and oral communication skillsComfort dealing with ambiguity and the ability to work independentlyExperience working with, and presenting to, senior executivesExcellent communication and presentation skills; be comfortable interacting with executive-level managementStrong financial modeling experience
Key Responsibilities
• Grow financial performance through analysis of financial results, forecasts, variances, and trends
Create recommendations to be presented to management and executivesDevelop financial models to support valuation, planning, and forecastingAid in the capital budgeting and expenditure planning processesReconcile existing transactions through cross-referencing of incoming and outgoing dataConduct comparables analysis and market research to support internal financial analysisMaintain up-to-date technical knowledge of financial instruments, market conditions, and trends

We are an Equal Opportunity Employer. Employment decisions are made without regard to race, color, religion, national or ethnic origin, sex, sexual orientation, gender identity or expression, age, disability, protected veteran status or other characteristics protected by law.",0
"We are looking for a Data Engineer to organize, manage, query, analyze terabytes of data from multiple different digital sources (mobile apps, websites, sensors). The ideal candidate has a passion for delving into data to help drive decision making in real-time for 180+ sports properties around the world.We are a 24/7/365 global sports entity, so a solid understanding and love of sports is highly recommended.We are looking for someone who...Thinks nothing is impossibleIs a tinkerer and implementor of big-data systemsHas a knack for data visualization to derive insightsIs equally comfortable with database systems and machine-learning algorithmsWhat you will be doing...Running analyses on terabytes of data that arise from digital assetsApplying machine-learning algorithms on data sets in order to cluster and segment themProviding insights from the data, to understand user behavior, predict user behavior, identify anomalies, and identify patternsBuilding, maintaining, and refining data dashboardsDriving new product development based on insights from the dataBe our MVP if you have...2 years+ of machine-learning experience with giant data-sets2 years+ of experience in data visualization techniques and best practices2 years+ of experience in working with Hadoop, Hive, Spark, and other big-data platforms2 years+ of experience with SQL, relational databases, NoSQL databases, including Postgres and Cassandra2 years+ of experience with Google Analytics, Firebase2 years+ of experience with AWS cloud services, such as EC2, EMR, RDS, Redshift2 years+ of experience in Java/C++/Python programmingExpert programmer and tinkerer, comfortable around operating systems, cloud computing, network protocolsWillingness to work in a high energy, fast-paced environmentStrong desire to learn and grow careerDegree in Computer Science/Engineering, with a heavy focus on machine-learning, data science, data engineering.Job Type: Full-timePay: $59,000.00 - $79,000.00 per yearBenefits:401(k)Dental InsuranceHealth InsurancePaid Time OffParental LeaveProfessional Development AssistanceRelocation AssistanceVision InsuranceSchedule:Monday to FridayWeekendsCOVID-19 considerations:To keep our employees as as safe as possible, we are working remotely and allowing new hires to begin their employment remotely, with the expectation that they will be able to relocate to Pittsburgh once it is safe to travel.Experience:machine-learning: 2 years (Required)SQL and relational database: 2 years (Required)Tableau: 2 years (Required)Hadoop/Hive: 2 years (Preferred)Java programming: 2 years (Required)Education:Bachelor's (Required)Location:Pittsburgh, PA 15206 (Required)Work authorization:United States (Required)Application Question:What is the largest data-set you have analyzed? And what techniques did you use to analyze it?Work Location:One locationCompany's website:www.yinzcam.comBenefit Conditions:Only full-time employees eligibleWork Remotely:Temporarily due to COVID-19",3
