description,y
"Overview:
SOS International LLC (SOSi) is seeking a Data Scientist to join our team in Vienna, VA. The Data Scientist will be a SME in architecting complex analytic solutions from a multitude of multi-national “big data” sets on a variety of highly sensitive and complex data sets. Driving a comprehensive data collection and exploitation strategy that will address worldwide trinational issues. This person will be using a variety of data mining/data analysis methods, using a variety of data tools, building and implementing models, using/creating algorithms and creating/running simulations. Working with a wide range of stakeholders and functional teams. The Candidate will have a passion for discovering solutions hidden in large data sets and working with stakeholder to imporve business outcomes.

Candidates must be technically adept to provide technical, strategic guidance to senior level database administrators and application developers in the creation and implementation of new databases, as well as the maintenance of major existing databases supporting evolving applications. Duties include leading and consulting to all levels of the organization on the design, development and implementation of logical database structures and classification schema; and developing policies and procedures to build, maintain and leverage the data model; provide technical, strategic guidance on the development of metadata tags, Document Type Definitions, and schemas using appropriate technologies for representation such as HTML and XML. Ensure that metadata and data standards and definitions will support both local business processes and system implementations thereof, and corporate requirements for sharing data.
Responsibilities:
Develop comprehensive Enterprise Data Collection and Exploitation Strategies that align with client transitional mission sets
Mine and analyze data from company databases to drive optimization and improvement of product development, marketing techniques and business strategies.
Develop and recommend data management policies, standards, practices and security measures to ensure effective and consistent data management operations.
Develop methods of ensuring that the data incompatibilities among systems are systematically eliminated, diagnose, isolate and expediently resolve complex problems pertaining to data infrastructure.
Assess the effectiveness and accuracy of new data sources and data gathering techniques.
Develop custom data models and algorithms to apply to data sets.
Use predictive modeling to increase and optimize customer experiences, revenue generation, ad targeting and other business outcomes.
Develop company A/B testing framework and test model quality.
Coordinate with different functional teams to implement models and monitor outcomes.
Develop processes and tools to monitor and analyze model performance and data accuracy.
Qualifications:

Possess an active in scope Secret Clearance
10+ years professional experience in solutioning complex data solutions
Strong problem solving skills with an emphasis on product development.
Experience using statistical computer languages (R, Python, SLQ, etc.) to manipulate data and draw insights from large data sets.
Experience working with and creating data architectures.
Knowledge of a variety of machine learning techniques (clustering, decision tree learning, artificial neural networks, etc.) and their real-world advantages/drawbacks.
Knowledge of advanced statistical techniques and concepts (regression, properties of distributions, statistical tests and proper usage, etc.) and experience with applications.
Excellent written and verbal communication skills for coordinating across teams.
A drive to learn and master new technologies and techniques.
We’re looking for someone with 10 years of experience manipulating data sets and building statistical models, has a Master’s or PHD in Statistics, Mathematics, Computer Science or another quantitative field, and is familiar with the following software/tools:
Coding knowledge and experience with several languages: C, C++, Java,
JavaScript, etc.
Knowledge and experience in statistical and data mining techniques: GLM/Regression, Random Forest, Boosting, Trees, text mining, social network analysis, etc.
Experience querying databases and using statistical computer languages: R, Python, SLQ, etc.
Experience using web services: Redshift, S3, Spark, DigitalOcean, etc.
Experience creating and using advanced machine learning algorithms and statistics: regression, simulation, scenario analysis, modeling, clustering, decision trees, neural networks, etc.
Experience analyzing data from 3rd party providers: Google Analytics, Site Catalyst, Coremetrics, Adwords, Crimson Hexagon, Facebook Insights, etc.
Experience with distributed data/computing tools: Map/Reduce, Hadoop, Hive, Spark, Gurobi, MySQL, etc.
Experience visualizing/presenting data for stakeholders using: Periscope, Business Objects, D3, ggplot, etc.
Display thorough knowledge of missions and needs, and considerable knowledge of Intelligence Community missions, needs, and information sharing requirements.
Possess knowledge of backup or archival software — Acronis Recovery Expert; Backup and archival software; Systems and data disaster recovery software; VERITAS NetBackup
Possess knowledge of database management system software — Database management software; Microsoft SQL Server; Quest Central; Sybase Replication Server.
Possess knowledge of development environment software — C; Microsoft Visual Basic; Prolog; Restructured extended executor REXX.
Possess knowledge of data modeling software; IBM Rational Data Architect; Visual Paradigm DB Visual ARCHITECT.
Possess knowledge of object or component oriented development software — Microsoft Visual C# .NET; Practical extraction and reporting language Perl; Sun Microsystems Java; Sybase PowerBuilder.
Preferred Qualifications:
Fluency in a foreign Language
Working Conditions:
Normal office working conditions with possible requirement to lift and/or move objects or packages of up to 25 lbs
Periods of non-traditional working hours including consecutive nights or weekends when necessary",3
"JOB SUMMARY
Responsible for maintaining scalable and reliable data pipelines that support data operations for Reporting, Analytics, Applications, and Data Science by gathering and processing raw data at scale. Delivers solutions by developing, testing, and supporting cloud-based streaming applications. Develops data set processes for data modeling, mining, and consumption.

MAJOR DUTIES AND RESPONSIBILITIES
Actively and consistently supports all efforts to simplify and enhance the customer experience.

Create and maintain scalable, reliable, consistent and repeatable pipelines that support data operations for Reporting, Analytics, Applications, and Data Science.

Gather and process real-time data at scale (including writing APIs, stream processing jobs, and aggregation jobs).

Expertly use cloud-based tools to ingest and process data.

Profile data to measure quality, integrity, accuracy, and completeness.

Manage life cycle of multiple data sources.

Increase speed to delivery by implementing workload/workflow automation solutions.

Interact with various stakeholders to understand their business needs, communicate project status and develop relationships to ensure satisfaction

Perform other duties as assigned.

REQUIRED QUALIFICATIONS
Skills/Abilities and Knowledge
Ability to read, write, speak and understand English
Ability to use a wide variety of open source technologies and cloud services
Strong coding experience using Scala or Java
Strong background in Linux/CentOS installation and administration
Strong knowledge in data storage that demonstrates knowledge of when to use a file system, relational database, or NoSQL variant
Strong experience with Spark or Hadoop/Hive
Experience receiving, converting, and cleansing big data
Ability to identify and resolve end-to-end performance, network, server, and platform issues
Attention to detail with the ability to effectively prioritize and execute multiple tasks
In-depth knowledge of Agile development methodologies

Education
Bachelor's degree in an engineering discipline or computer science

Related Work Experience
3-5 years of designing and building Scala or Java applications
2+ years of designing and building cloud native applications
2+ years of Linux/Unix/CentOS system admin
1+ year(s) of designing and building Kafka or Kinesis applications

WORKING CONDITIONS
Office environment",3
"The Data Analyst Associate performs tasks related to the design, implementation, support/maintenance, and enhancement of NU's enterprise, vendor and in-house developed applications. Documents functional requirements, analyzes requirements in the context of software and processes, develops and executes test plans, assists with and documents business process improvement efforts, and works with production issues. Completes content, process, and procedures for technical and functional system work that is low in complexity. Receives direction and oversight from senior staff.
Specific Responsibilities:
Strategic Planning
Participates with senior analysts, end users and peers to ensure that user requirements are gathered, analyzed, all gaps are documented, and all deliverables completed (adhering to approved methodology and documentation standards).
Participates with functional users and technical staff to determine best approaches, ensuring that approved solutions are implemented in a timely and correct fashion.
Administration
Contributes to the creation of accurate documentation of process, procedure, and system/application configuration.
Provides input into the creation and maintenance of test scripts, implementation project plans, roll out communications and training materials.
Identifies simple use cases.
Development
Provides input into test scripts and performs detailed testing for simple use cases to ensure that the implemented software functions correctly.
Participates in iterative feedback processes among users, developers, and analysts to ensure software functionality aligns with requirements.
Performance
Enters basic software configurations to meet user needs.
Collaborates with technical, reporting and application resources to analyze and resolve basic production issues in a timely manner.
Performs other duties as assigned.
Minimum Qualifications:
Successful completion of a full 4-year course of study in an accredited college or university leading to a bachelor's or higher degree in a major such as computer science, information technology, or related; OR appropriate combination of education and experience.
Preferred Competencies: (Skills, knowledge, and abilities)
Experience configuring or administering a Student Information System software package such as Salesforce, PowerSchool, eSIS, Infinite Campus, Genius SIS, or similar product.
Experience configuring or administering a Learning Management System (LMS) such as Schoology, Moodle, Canvas, Blackboard Learn or similar product.
Experience creating training or documentation materials and providing technical assistance to personnel in a K-12 or higher education setting.
Ability to create and quality check SQL database queries.
Advanced Excel skills.
Experience using or willingness to learn a data visualization software package such as Tableau.
Experience using or willingness to learn a statistical analysis software package such as SAS, STATA, or SPSS.",0
"Simpluris is a national class action settlement administrator established in 2007 with offices in Florida and California. We provide a suite of technology-based services to develop, execute and administer class action lawsuits from discovery through distribution. With a strong focus on customer service and utilizing proprietary systems and innovative solutions, Simpluris has built a first-rate reputation for handling cases. Our core values and our commitment to excellence drive our Mission in providing premium settlement administration services. We are a purpose driven company made up of an ever expanding team of purpose driven people.
The opportunity looks like this...
Simpluris seeks to grow its Data Analyst team in our Winter Park, Florida office. We are primarily looking for an individual with a naturally analytical and curious mind who can see past the surface and understand the depth and complexities of the various issues a particular problem possesses and whom can identify clear paths to solutions. They must be able to view a problem from multiple angles and aspects to understand the client's needs. Most of our data projects are presented in a word problem type format which must be read and the project requirements extrapolated out from. This position requires working with our project management team in receiving various types and sources of data, interpreting and developing data project requirements, and utilizing tools such as Python, Excel, and SQL to cleanse, transform, and perform calculations against data as necessary for internal and external systems. The ideal candidate will have advanced Microsoft Excel skills, some experience utilizing Python or SQL, flourishes in a team dynamic, and possesses a passion for efficient and real world data applications. This opportunity is best suited for the self-starter who enjoys solving problems and wishes to be part of a fast-paced environment where they might challenge themselves and expand their knowledge and experience.
Requirements
Here is what we need from you...
Proficiency in data manipulation using MS Excel (Pivot Tables, VLOOKUP, etc.), SQL (SELECT/JOIN), and/or Python (Pandas, NumPy)
Ability to succinctly explain and thoroughly document steps of data analysis
Ability to follow instructions / SOP’s and develop new SOP’s
Ability to self-manage and work independently as needed
Ability to communicate data issues effectively to non-technical users
Here is what you will be doing...
Perform data cleansing/de-duplication/merging/calculation/analysis
Deal with various forms and sources of data utilizing tools including Microsoft Excel, SQL, R & Python
Interpret and develop project data and calculation requirements
Identifying and developing improved processes and workflows
Prioritize, organize, and audit work effectively against deadlines
Interface with internal/external staff & clients (technical & non-technical) directly resolving issues with data
Skillsets we’re looking for...
Solid critical thinking, analytical, and problem solving abilities
Comfort with basic algebra, logic, and statistics
Strong interpersonal communication skills (both oral and written)
High proficiency (i.e. Power User) in Microsoft Excel with knowledge of VLOOKUP, pivot tables, and other advanced functions
Some experience with a programming language (e.g. SQL, C#, JavaScript) a plus
Python or R experience preferred
Ability to learn new tools and business processes quickly
Prior experience performing ETL (extract, transform, and load) functions a plus
Prior experience with reporting (e.g., SSRS) or dashboarding (e.g., PowerBI) a plus
Education with majors related to IT/MIS, accounting, math, or similar programs
Benefits
If you think you have what it takes, come join our growing team of purpose driven people! This is a full time, permanent position and compensation is dependent upon experience. We offer benefits such as medical, dental, vision, life insurance and 401k plus bonus opportunities. Please submit salary requirements along with resume.
This is who we are…
Find out more about Simpluris, our company, our people, and our culture here:
YouTube Simpluris Culture Video (https://youtu.be/8kQzzp-D8bs)
https://www.linkedin.com/company/simpluris-inc
https://www.facebook.com/simpluris/
At Simpluris, we live by a code and our code is defined through our core values. We are looking for those who can commit to and live by these values as those are the type of individuals who will be successful and thrive here. However, if you feel you don’t resonate with these values, or if you’re not able to engage at this level, we’re probably not a good fit for one another. We expect from ourselves and those who choose to join us to be accountable for themselves and perform at or above the same level we do.
We realize not everyone is ready for this level of engagement and appreciate the recognition by those who are honest to see this is the not right fit or place for them. But for those who can commit, we believe you would make an ideal candidate to join our team based on our following core values:
Simply Elevate – Elevate yourself & others. We are stronger together.
Be Responsive – Move & execute.
Deliver – Do what you say you’re going to do. Say what you mean & mean what you say.
Exude Passion – Find the greater purpose, fully commit and participate with passion.
Work Without Boundaries – See it, own it, solve it, do it. Success is everyone’s responsibility.
Solutions Driven – Go beyond the surface, seek to continually improve & refine.",0
"Strength Through Diversity
Ground breaking science. Advancing medicine. Healing made personal.

The Data Analyst II oversees activities related to data integrity, security and enhancement of the value of data. The Data Analyst II may direct the movement of data across multiple systems; oversee its validation and organization and make sure that data is available to appropriate people and systems within an organization. The Data Analyst II will also develop and execute reports that will be important assets of the practice as they continue to develop and evaluate a new model of care.

Roles & Responsibilities:
Work with the clinical and administrative staff of the practice to define data reporting needs
Develop analytic reports that are easily understandable by clinical and administrative staff
Use modeling techniques and tools in analyzing and specifying data structure
Implement best practices in data management to ensure the integrity of the data, the quality of data processes and deliver analyzable or analyzed data to a variety of internal and external clients of the affiliated practice
Maintain data integrity and completes data analysis as necessary
Complete data capture, data extraction and analysis
Develop, maintain or implement procedures for data entry, data cleaning, documentation and other administrative tasks
Document, implement, maintain or recommend operating methods to improve processing, distribution, data flow, collection, database editing procedures
May define parameters for file or space utilization
Work closely with IT management and staff
Access data in the Data Warehouse, as required
Assist clinical and administrative staff with queries, statistical analyses, reports and technical difficulties related to data retrieval
Design and write custom applications needed to ensure the database meets requirements for the entry, management and reporting of data
Identify and recommend solutions to data management issues
Maintain knowledge of the current regulations and technologies related to data management
Write and prepare manuscripts and other materials for internal and external audiences
Perform other related duties
Help to build and perpetuate a practice environment and culture of collaboration, respect, learning, flexibility and fun among all team members
Requirements:
Bachelor’s degree or equivalent education/work experience. Master’s degree in relevant field of study preferred
3 years of analytics experience including report development and database application/management experience, preferably in a large medical center or healthcare environment
Advanced knowledge of database applications / management, SQL and /or SAS. Knowledge of computer programming preferred
Excellent conceptualization, design and analytical skills
Excellent written and oral communication skills
Exceptional attention to detail and accuracy
Strength Through Diversity

The Mount Sinai Health System believes that diversity is a driver for excellence. We share a common devotion to delivering exceptional patient care. Yet we’re as diverse as the city we call home- culturally, ethically, in outlook and lifestyle. When you join us, you become a part of Mount Sinai’s unrivaled record of achievement, education and advancement as we revolutionize medicine together.

We work hard to acquire and retain the best people, and to create a welcoming, nurturing work environment where you can develop professionally. We share the belief that all employees, regardless of job title or expertise, can make an impact on quality patient care.

Explore more about this opportunity and how you can help us write a new chapter in our story!

Who We Are

Over 38,000 employees strong, the mission of the Mount Sinai Health System is to provide compassionate patient care with seamless coordination and to advance medicine through unrivaled education, research, and outreach in the many diverse communities we serve.

Formed in September 2013, The Mount Sinai Health System combines the excellence of the Icahn School of Medicine at Mount Sinai with seven premier hospital campuses, including Mount Sinai Beth Israel, Mount Sinai Beth Israel Brooklyn, The Mount Sinai Hospital, Mount Sinai Queens, Mount Sinai West (formerly Mount Sinai Roosevelt), Mount Sinai St. Luke’s, and New York Eye and Ear Infirmary of Mount Sinai.

The Mount Sinai Health System is an equal opportunity employer. We promote recognition and respect for individual and cultural differences, and we work to make our employees feel valued and appreciated, whatever their race, gender, background, or sexual orientation.

EOE Minorities/Women/Disabled/Veterans",0
"Gatestone & Co. is looking for an efficient, detail-oriented Data Analyst. The Data Analyst will be responsible for facilitating the issuance of letters and digital communications to consumers, in accordance to regulatory and client expectations.
Our ideal candidate is self-motivated and produces high-quality work. They are able to prioritize tasks appropriately and effectively, and handle multiple tasks at once, while maintaining strong follow-up skills to ensure all responsibilities are handled.
In this role you will:
Complete service requests as it relates to the creation of new letters and digital communications
Perform daily tasks relating to quality control and data validation
Demonstrate accuracy and thoroughness; look for ways to improve and promote quality; apply feedback to improve performance; monitor own work to ensure quality
Assist the Compliance Manager in the development of an effective record keeping system, including letter approvals, letter log, and inventory and regulatory requirements
Import/export data from text format into Excel and vice versa, while maintaining field-level integrity and data accuracy
Work closely with IT and other departments in regards to letter status, communications to consumers, etc.
Other duties as assigned

Who We Are
Founded in 1926, Gatestone is an industry leader providing exceptional outsourced Customer Contact Centre and Business Process Outsourcing (BPO) solutions to the world’s most respected organizations. Our clients are some of the world’s most respected organizations including Fortune 500 companies.
Started by Nicholas Wilson from humble beginnings, Gatestone has grown into a major global outsource provider with 10 fully-integrated sites located across North America, Latin American, Central America and Asia offering skill sets across multiple experience levels and languages. Still under original ownership, the company is supported by a long-tenured management team who provide unparalleled strategic leadership at all levels throughout the organization.

Benefits of Working at Gatestone
At Gatestone, we understand that our corporate success starts by attracting the right people, developing and mentoring those that show potential and taking steps to retain and promote our top performers.
We believe in our employees and invest in providing the best growth opportunities. Promotions at Gatestone are based on merit, past performance, and leadership potential. We recognize our top employees and help them succeed. We also have a full time Employee Engagement Specialist who ensures we have fun while working hard!
When you join Gatestone, you do more than join a company. You become part of a team of talented and self- driven individuals dedicated to bring success to the Company and their lives.
Be a part of an Awarding Winning Company.
Check us out in Instagram to see how much fun the Gatestone experience really is!
https://www.instagram.com/gatestonebpo
Skills Required:
An analytical thinker, able to synthesize complex or diverse information, collect and research data, use intuition and experience to complement data; able to manage specialized work efficiently with confidence and competence
A problem solver who identifies and resolves problems in a timely manner; gathers and analyzes information skillfully, uses reason even when dealing with emotional topics
Ability to read, analyze, and interpret corporate, compliance, and legal documentation, as needed
Detail oriented, well organized and has proven ability to work within stringent timeframes
Excellent verbal, written, listening, and interpersonal skills
Efficient with troubleshooting
Familiarity with ticketing systems

Qualifications:
2+ years in an administrative role
Proficient with Microsoft Office suite
Knowledge of AS400 is required
Ability to pass a background check and drug screen
High school diploma or GED is required",0
